res_id_res,res_comentario,res_mod_correo,res_aprobado,res_calif_estrellas,visitas_vi_usr_correo,visitas_vi_mus_id,visitas_vi_fechahora
808,Sunt quidem facilis voluptates repellat veniam iure atque officia occaecati.,mod@musedmx.com,1,4,adelaroybal@example.com,462,2025-03-19 10:27:44
809,Id nulla voluptatum similique tenetur tempora unde eligendi fugiat dolor.,mod@musedmx.com,1,5,gmadera@example.org,462,2025-02-09 22:14:19
810,Sequi aspernatur quod suscipit similique soluta nulla libero expedita.,mod@musedmx.com,1,2,irosas@example.com,462,2025-04-25 01:42:50
811,Blanditiis esse repudiandae molestiae et.,mod@musedmx.com,1,4,esther14@example.com,462,2025-05-02 09:40:08
812,Minus veritatis dolore suscipit numquam quisquam qui.,mod@musedmx.com,1,4,paola60@example.org,462,2025-03-01 16:01:37
813,Placeat nihil ut eligendi in tempore dolores impedit occaecati.,mod@musedmx.com,1,4,lorenzopuente@example.org,462,2025-03-15 00:10:25
814,Maiores provident iusto quo aut quia nisi.,mod@musedmx.com,1,5,ccandelaria@example.org,462,2025-02-01 06:51:19
815,Doloribus doloribus id doloribus ab aperiam iusto maiores atque enim.,mod@musedmx.com,1,1,ecalderon@example.net,462,2025-05-09 04:54:59
816,Natus repellat iure eveniet explicabo quasi repudiandae corporis distinctio.,mod@musedmx.com,1,4,qapodaca@example.org,462,2025-02-26 07:49:55
817,Totam ipsum deleniti autem esse debitis mollitia.,mod@musedmx.com,1,3,valejandro@example.org,462,2025-04-02 16:11:16
818,Ipsum inventore quam tempora optio.,mod@musedmx.com,1,1,esteban04@example.net,462,2025-04-23 06:59:58
819,Praesentium nam praesentium deleniti blanditiis nobis dicta.,mod@musedmx.com,1,5,granadoesparta@example.net,462,2025-04-10 09:27:36
820,Velit minima dolorem libero eaque incidunt.,mod@musedmx.com,1,5,del-rioabigail@example.org,462,2025-03-09 18:56:14
821,Odit voluptate omnis eos officia expedita explicabo nam sit.,mod@musedmx.com,1,5,jgalarza@example.net,462,2025-02-10 13:49:04
822,Laboriosam repudiandae aperiam aut repellat recusandae.,mod@musedmx.com,1,3,qcolunga@example.com,462,2025-04-14 08:09:11
823,Soluta quam ullam in iste.,mod@musedmx.com,1,3,joaquinleon@example.net,462,2025-02-01 23:16:40
824,Iusto nam accusantium fuga quod omnis veritatis.,mod@musedmx.com,1,5,olivia36@example.org,462,2025-03-01 06:35:47
825,Beatae iure totam eius temporibus libero.,mod@musedmx.com,1,5,eloy78@example.net,462,2025-05-04 22:38:22
826,Recusandae corrupti nobis doloremque sed consectetur dolor doloribus repellat.,mod@musedmx.com,1,2,ivancasanova@example.com,462,2025-05-17 14:36:43
827,Sed iure amet fugit eaque praesentium.,mod@musedmx.com,1,3,anel09@example.com,462,2025-01-15 03:43:42
828,Pariatur ea quae aspernatur nesciunt ipsa totam quo.,mod@musedmx.com,1,2,caballerojulio@example.com,462,2025-05-26 06:57:10
829,Veritatis provident deserunt labore atque magni quae excepturi.,mod@musedmx.com,1,3,rufinodelgadillo@example.com,462,2025-02-16 20:21:03
830,Ducimus doloribus ipsam dolorem officia.,mod@musedmx.com,1,1,dulce55@example.com,462,2025-02-14 02:28:31
831,Quibusdam dignissimos dolorum magni voluptate iusto.,mod@musedmx.com,1,1,iglesiashoracio@example.net,462,2025-05-09 03:17:01
832,Odio porro labore et rem quaerat quia.,mod@musedmx.com,1,1,acordero@example.com,462,2025-03-17 21:01:10
833,Vitae corporis deleniti nobis distinctio veniam nulla.,mod@musedmx.com,1,5,sonia28@example.com,462,2025-02-04 00:16:44
834,Sapiente nihil nostrum distinctio non.,mod@musedmx.com,1,5,fidel14@example.com,462,2025-05-04 19:38:35
835,Nihil nulla maiores dolores perferendis sequi sed totam alias incidunt iure.,mod@musedmx.com,1,2,rubyesparza@example.com,462,2025-02-05 11:31:13
836,Dicta doloribus facere ratione nam.,mod@musedmx.com,1,2,javier96@example.org,462,2025-03-06 05:27:28
837,Facilis numquam impedit recusandae veritatis.,mod@musedmx.com,1,5,dgarza@example.com,462,2025-02-01 07:29:26
838,Eum qui dolor excepturi voluptatum harum accusantium quos.,mod@musedmx.com,1,5,saldanasoledad@example.com,462,2025-03-30 04:23:34
839,Similique alias rem quibusdam blanditiis architecto voluptas.,mod@musedmx.com,1,2,gracielacordova@example.net,462,2025-03-26 10:49:12
840,Mollitia fuga rerum consequuntur eius culpa ipsa quod corrupti delectus.,mod@musedmx.com,1,5,ytorres@example.com,462,2025-04-23 17:19:07
841,Eum itaque earum repellat possimus id.,mod@musedmx.com,1,4,rodolfo57@example.org,462,2025-02-08 12:22:00
842,Dicta iure laboriosam veritatis repudiandae commodi.,mod@musedmx.com,1,1,avilaenrique@example.net,462,2025-02-21 04:27:24
843,Pariatur nostrum soluta ipsam dolorum cupiditate.,mod@musedmx.com,1,2,genaro38@example.org,462,2025-04-06 17:56:21
844,Iusto a asperiores corrupti veniam modi ipsum ipsam aliquam.,mod@musedmx.com,1,3,camilonava@example.com,462,2025-01-23 15:58:19
845,In voluptatibus quia quo rem doloremque praesentium iste vero.,mod@musedmx.com,1,2,maria-josepuga@example.com,462,2025-01-02 20:44:16
846,Corporis fuga quis eos distinctio inventore mollitia.,mod@musedmx.com,1,2,pcarvajal@example.net,462,2025-01-21 15:23:38
847,Doloremque ab eius numquam reiciendis.,mod@musedmx.com,1,3,leonardochavarria@example.org,462,2025-01-29 07:12:24
848,Atque perspiciatis necessitatibus nemo placeat deserunt eum.,mod@musedmx.com,1,1,jose-emilio94@example.org,462,2025-02-08 23:27:23
849,Aut eaque hic est explicabo nam minus ratione architecto molestias.,mod@musedmx.com,1,1,gsolorio@example.net,462,2025-01-27 21:59:44
850,Et magni sed nobis optio deserunt praesentium debitis facere necessitatibus voluptas.,mod@musedmx.com,1,4,madridserafin@example.net,462,2025-04-28 08:17:42
851,Occaecati tempore debitis cupiditate ducimus ab.,mod@musedmx.com,1,1,vmelgar@example.org,462,2025-04-19 03:47:13
852,Perspiciatis praesentium voluptas omnis alias qui eum.,mod@musedmx.com,1,5,ramosdaniela@example.org,462,2025-01-22 00:21:20
853,Deleniti dolorem nemo assumenda vitae dolor fugit ex.,mod@musedmx.com,1,1,rosarioulloa@example.org,462,2025-01-15 08:13:13
854,Distinctio placeat tempora aperiam quas occaecati deserunt eum unde.,mod@musedmx.com,1,1,luis-manuelpatino@example.net,462,2025-01-17 10:21:50
855,Magnam culpa reiciendis quo rerum nemo ipsam.,mod@musedmx.com,1,1,juan-carlos74@example.com,462,2025-03-29 17:31:53
856,Quod deserunt quod cum blanditiis culpa veritatis.,mod@musedmx.com,1,1,lilia68@example.org,462,2025-01-27 23:22:29
857,Quo occaecati reprehenderit iste at cumque.,mod@musedmx.com,1,4,xmeraz@example.net,462,2025-03-17 09:39:47
858,Hic dolores modi eveniet molestias error incidunt et.,mod@musedmx.com,1,1,yzamora@example.org,462,2025-01-06 21:47:45
859,Sed sequi tenetur quaerat officia officia incidunt asperiores.,mod@musedmx.com,1,3,pinedaaldo@example.com,462,2025-01-14 20:00:34
860,Deserunt atque laborum natus quod.,mod@musedmx.com,1,1,gbriseno@example.net,462,2025-04-28 00:07:52
861,Mollitia ad optio distinctio omnis id veniam.,mod@musedmx.com,1,4,ttoro@example.com,462,2025-03-18 16:09:50
862,Repellat explicabo eaque dolores nobis saepe veniam ab.,mod@musedmx.com,1,1,carrillodaniel@example.net,462,2025-04-21 21:26:22
863,Quaerat ipsum tenetur cupiditate temporibus amet rerum a.,mod@musedmx.com,1,5,frida66@example.net,462,2025-01-30 19:20:55
864,Officia at delectus dignissimos exercitationem unde praesentium.,mod@musedmx.com,1,2,leonor86@example.com,462,2025-04-27 08:04:59
865,Nisi voluptates ratione vitae placeat.,mod@musedmx.com,1,3,villegasvictor@example.org,462,2025-01-13 05:56:40
866,Nisi voluptate accusamus odio consequuntur repudiandae inventore iusto molestiae.,mod@musedmx.com,1,3,armando38@example.net,462,2025-04-18 18:03:53
867,Impedit cumque soluta ipsa.,mod@musedmx.com,1,3,omar70@example.com,462,2025-02-28 01:13:35
868,Deleniti enim a dolorem consequatur.,mod@musedmx.com,1,4,aangulo@example.com,462,2025-01-07 08:38:23
869,Quia adipisci sit aliquid sunt blanditiis ex.,mod@musedmx.com,1,2,mgastelum@example.net,462,2025-01-29 07:53:11
870,Voluptatibus necessitatibus natus nostrum repellendus totam.,mod@musedmx.com,1,5,lalonso@example.com,462,2025-03-06 11:59:45
871,Ducimus harum ex perferendis odio cumque at voluptatibus.,mod@musedmx.com,1,5,holguinasuncion@example.com,462,2025-05-08 11:34:44
872,Exercitationem itaque possimus inventore praesentium ex odit officia vel dolore.,mod@musedmx.com,1,2,raquel03@example.org,462,2025-02-07 08:08:06
873,Aspernatur doloremque cum aliquid est repellat possimus.,mod@musedmx.com,1,1,rodolfo82@example.org,462,2025-03-04 10:58:09
874,Officiis architecto occaecati molestias dicta veritatis qui reprehenderit dolor.,mod@musedmx.com,1,1,mariano37@example.com,462,2025-03-23 08:22:04
875,Odio facilis eos at dolorem.,mod@musedmx.com,1,1,cesarbatista@example.net,462,2025-03-01 05:42:43
876,Expedita error omnis ipsa dolorem quaerat ipsum eius.,mod@musedmx.com,1,4,vergaraadalberto@example.org,462,2025-05-02 17:56:19
877,Soluta perferendis aspernatur facere quo quas minus ipsa molestias.,mod@musedmx.com,1,3,tsosa@example.net,462,2025-04-16 11:08:04
878,Facilis nostrum sapiente eius ullam expedita.,mod@musedmx.com,1,2,centenodiego@example.net,462,2025-04-24 15:16:16
879,Fugiat perspiciatis nemo doloribus at dolores repellat ducimus.,mod@musedmx.com,1,3,emilia50@example.net,462,2025-04-28 02:25:44
880,Perferendis odio necessitatibus natus provident incidunt molestiae facere.,mod@musedmx.com,1,1,mamador@example.com,462,2025-04-04 05:44:58
881,Autem suscipit assumenda eveniet corrupti.,mod@musedmx.com,1,3,tomas41@example.net,462,2025-01-18 21:31:35
882,Nostrum aspernatur dolor animi deleniti.,mod@musedmx.com,1,5,luis-manuel57@example.com,462,2025-05-03 06:54:15
883,A ad cum nostrum deserunt iste nemo accusamus amet sequi.,mod@musedmx.com,1,1,karinaquesada@example.org,462,2025-02-07 11:05:42
884,Pariatur quidem cupiditate sit commodi at.,mod@musedmx.com,1,1,luis-miguel95@example.org,462,2025-01-21 07:35:55
885,Error dolores eaque sapiente amet quam.,mod@musedmx.com,1,2,menapilar@example.net,462,2025-01-29 07:12:47
886,Veniam ratione quidem eaque laborum excepturi neque similique.,mod@musedmx.com,1,1,rebeca85@example.org,462,2025-04-21 09:55:29
887,Illo commodi temporibus fugiat a perspiciatis.,mod@musedmx.com,1,1,itzelcepeda@example.net,462,2025-05-11 08:37:08
888,Voluptatem rerum provident est distinctio impedit accusamus at.,mod@musedmx.com,1,4,wjurado@example.com,462,2025-02-25 05:01:49
889,Aliquid harum asperiores laboriosam dolor quaerat laborum quod officiis.,mod@musedmx.com,1,2,oalmonte@example.org,462,2025-03-16 12:16:59
890,Maxime incidunt in voluptatem inventore distinctio illo quaerat tempore explicabo porro.,mod@musedmx.com,1,3,pchavarria@example.com,462,2025-04-28 05:28:20
891,Minus rerum minus architecto sapiente.,mod@musedmx.com,1,5,tvillagomez@example.net,462,2025-01-08 02:18:56
892,Nobis harum dolores et quasi occaecati.,mod@musedmx.com,1,4,helenaestrada@example.com,462,2025-03-06 03:43:35
893,Ex sit mollitia doloribus odit sequi alias ea.,mod@musedmx.com,1,2,delia78@example.com,462,2025-01-05 16:29:36
894,Atque distinctio animi laboriosam quis occaecati ad vero doloremque ipsa voluptas.,mod@musedmx.com,1,1,isabelrosales@example.com,462,2025-04-06 11:21:45
895,Nihil magnam illo facilis ad.,mod@musedmx.com,1,1,ffonseca@example.net,462,2025-05-18 04:40:59
896,Laudantium sed exercitationem ipsam eius asperiores.,mod@musedmx.com,1,1,raulrosas@example.org,462,2025-01-10 10:51:08
897,Incidunt velit neque asperiores.,mod@musedmx.com,1,2,psaldivar@example.com,462,2025-05-09 02:42:06
898,Voluptate nobis dolorum nemo ex error ratione a fugit.,mod@musedmx.com,1,5,jose-mariacollado@example.net,462,2025-03-25 05:57:50
899,Et corporis facilis ullam veniam.,mod@musedmx.com,1,4,regaladomaximiliano@example.com,462,2025-02-13 13:36:05
900,Amet provident quos sed quasi eligendi tempore rerum vitae quasi.,mod@musedmx.com,1,1,luisaalcantar@example.com,462,2025-05-04 13:46:04
901,Mollitia itaque quisquam ea dignissimos consequuntur culpa perferendis tempora dolorum.,mod@musedmx.com,1,3,modesto43@example.org,1337,2025-04-21 14:53:27
902,Nihil numquam ea odio reiciendis nobis.,mod@musedmx.com,1,2,teresa91@example.org,1337,2025-02-24 08:44:24
903,Temporibus quaerat eaque assumenda omnis minus repellendus earum quo.,mod@musedmx.com,1,4,aracelide-leon@example.org,1337,2025-02-27 16:02:19
904,Cum quis natus tenetur accusamus deserunt perspiciatis tempore.,mod@musedmx.com,1,1,oscarbetancourt@example.com,1337,2025-02-06 17:19:52
905,Esse sapiente deserunt laboriosam corrupti.,mod@musedmx.com,1,2,normavillareal@example.net,1337,2025-02-01 19:04:15
906,Quibusdam ea neque nulla aperiam veniam corrupti aperiam.,mod@musedmx.com,1,1,roybalestela@example.net,1337,2025-05-08 18:54:40
907,Nisi molestiae ipsa ut eos quis sint voluptatibus illum.,mod@musedmx.com,1,5,ysamaniego@example.org,1337,2025-03-07 12:53:42
908,Harum excepturi ullam natus quae consectetur odit quas.,mod@musedmx.com,1,2,adelaroybal@example.com,1337,2025-01-12 16:10:34
909,Consequatur at quas dolor aliquid qui aut et libero voluptates.,mod@musedmx.com,1,2,gmadera@example.org,1337,2025-02-04 02:31:03
910,Itaque iste sequi quidem ea ipsum repudiandae.,mod@musedmx.com,1,1,irosas@example.com,1337,2025-01-22 03:01:25
911,Quas earum dolore enim ea id et dolorum debitis.,mod@musedmx.com,1,3,esther14@example.com,1337,2025-06-04 13:38:32
912,Reprehenderit error similique itaque ut molestiae nemo et optio.,mod@musedmx.com,1,3,paola60@example.org,1337,2025-01-14 14:59:00
913,Corporis possimus natus cumque repudiandae nam odio.,mod@musedmx.com,1,1,lorenzopuente@example.org,1337,2025-01-07 02:34:33
914,Consequatur tenetur animi rerum consequatur ducimus sint saepe.,mod@musedmx.com,1,1,ccandelaria@example.org,1337,2025-01-31 03:21:07
915,Tenetur corrupti tempore repudiandae saepe perspiciatis sint sapiente modi.,mod@musedmx.com,1,2,ecalderon@example.net,1337,2025-03-20 18:03:54
916,Sit perspiciatis voluptatibus impedit vel rem.,mod@musedmx.com,1,3,qapodaca@example.org,1337,2025-01-08 22:36:36
917,Explicabo voluptatibus iure animi velit porro voluptates optio.,mod@musedmx.com,1,3,valejandro@example.org,1337,2025-04-11 03:37:09
918,Necessitatibus ducimus velit earum quam voluptas mollitia animi aliquam.,mod@musedmx.com,1,4,esteban04@example.net,1337,2025-05-03 04:53:00
919,Ratione fugiat delectus qui harum odio.,mod@musedmx.com,1,5,granadoesparta@example.net,1337,2025-01-01 18:57:32
920,Doloremque praesentium ullam quia cumque voluptatem voluptatum quibusdam molestias error.,mod@musedmx.com,1,2,del-rioabigail@example.org,1337,2025-05-22 20:03:10
921,Atque debitis tempore assumenda occaecati consectetur id ratione possimus minus.,mod@musedmx.com,1,4,jgalarza@example.net,1337,2025-02-23 13:01:23
922,Eius quisquam quisquam totam temporibus magni blanditiis earum quis optio.,mod@musedmx.com,1,2,qcolunga@example.com,1337,2025-01-21 20:58:16
923,Incidunt placeat similique dolorem reprehenderit doloremque voluptates quam minima.,mod@musedmx.com,1,3,joaquinleon@example.net,1337,2025-04-02 16:48:35
924,Doloremque dolore itaque soluta ipsum inventore placeat possimus quibusdam.,mod@musedmx.com,1,5,olivia36@example.org,1337,2025-05-01 18:59:31
925,Iusto eligendi debitis sapiente tenetur perferendis dignissimos quaerat atque.,mod@musedmx.com,1,1,eloy78@example.net,1337,2025-05-09 06:03:11
926,Modi ullam aperiam exercitationem voluptatem praesentium officia quos.,mod@musedmx.com,1,4,ivancasanova@example.com,1337,2025-05-04 12:46:58
927,Adipisci modi illo eaque animi ratione necessitatibus nisi placeat corporis veritatis.,mod@musedmx.com,1,3,anel09@example.com,1337,2025-01-08 17:02:32
928,Veritatis nemo iste dolores magni nostrum odio doloremque atque accusantium.,mod@musedmx.com,1,1,caballerojulio@example.com,1337,2025-05-27 10:59:53
929,Tempora cupiditate reiciendis quo eius.,mod@musedmx.com,1,2,rufinodelgadillo@example.com,1337,2025-04-09 16:51:04
930,Laboriosam ratione provident consequuntur facilis quibusdam velit nulla.,mod@musedmx.com,1,4,dulce55@example.com,1337,2025-02-14 08:40:12
931,Veritatis facilis corrupti tempore cumque quisquam.,mod@musedmx.com,1,4,iglesiashoracio@example.net,1337,2025-05-23 06:27:38
932,Totam unde dignissimos tenetur ex deserunt tenetur.,mod@musedmx.com,1,5,acordero@example.com,1337,2025-05-31 19:40:49
933,Natus quidem vitae accusantium officiis ea.,mod@musedmx.com,1,2,sonia28@example.com,1337,2025-04-24 20:07:26
934,Voluptatum veritatis dignissimos praesentium et.,mod@musedmx.com,1,3,fidel14@example.com,1337,2025-03-23 03:52:41
935,Harum molestias earum maiores libero nemo ab veniam.,mod@musedmx.com,1,5,rubyesparza@example.com,1337,2025-03-18 00:16:03
936,Rerum necessitatibus ut consequuntur nihil porro voluptates.,mod@musedmx.com,1,3,javier96@example.org,1337,2025-02-28 10:42:51
937,Culpa cupiditate tempora laborum architecto esse dolor maxime facilis occaecati provident.,mod@musedmx.com,1,5,dgarza@example.com,1337,2025-05-23 10:52:06
938,Esse libero rem voluptate vel pariatur.,mod@musedmx.com,1,1,saldanasoledad@example.com,1337,2025-01-01 14:56:18
939,Explicabo placeat corporis alias assumenda dolore expedita aperiam fugit.,mod@musedmx.com,1,2,gracielacordova@example.net,1337,2025-05-30 17:42:16
940,At expedita possimus sequi eum iste.,mod@musedmx.com,1,1,ytorres@example.com,1337,2025-04-10 12:28:04
941,Aperiam est aspernatur molestias inventore excepturi.,mod@musedmx.com,1,3,rodolfo57@example.org,1337,2025-01-14 20:28:17
942,Hic porro dolorum nesciunt voluptatibus id.,mod@musedmx.com,1,3,avilaenrique@example.net,1337,2025-01-17 13:48:36
943,Sed delectus eius nostrum est nobis.,mod@musedmx.com,1,4,genaro38@example.org,1337,2025-01-06 04:12:53
944,Officiis ipsa illum suscipit quisquam.,mod@musedmx.com,1,4,camilonava@example.com,1337,2025-02-13 19:34:16
945,Alias accusamus nemo soluta modi incidunt consectetur pariatur.,mod@musedmx.com,1,1,maria-josepuga@example.com,1337,2025-03-09 01:54:12
946,Iure laudantium totam unde facilis.,mod@musedmx.com,1,5,pcarvajal@example.net,1337,2025-04-16 23:01:20
947,Officiis mollitia quasi nam quaerat ut ut.,mod@musedmx.com,1,2,leonardochavarria@example.org,1337,2025-06-03 17:58:09
948,Quos laborum illum molestiae perspiciatis reiciendis.,mod@musedmx.com,1,3,jose-emilio94@example.org,1337,2025-05-04 06:53:30
949,Non alias cupiditate veniam alias consequatur occaecati vel amet accusantium nemo.,mod@musedmx.com,1,5,gsolorio@example.net,1337,2025-06-01 01:35:19
950,Quia sequi dolores consequatur voluptates quia modi quae a repellat.,mod@musedmx.com,1,4,madridserafin@example.net,1337,2025-04-27 04:17:25
951,Praesentium neque nemo earum alias.,mod@musedmx.com,1,2,vmelgar@example.org,1337,2025-03-07 07:58:14
952,Maxime id optio corrupti facilis earum.,mod@musedmx.com,1,1,ramosdaniela@example.org,1337,2025-04-11 09:43:21
953,Facere numquam minus sunt neque dolorem laborum ex recusandae nam.,mod@musedmx.com,1,1,rosarioulloa@example.org,1337,2025-01-05 14:13:56
954,Eligendi dolor velit aspernatur harum distinctio voluptate dicta non.,mod@musedmx.com,1,3,luis-manuelpatino@example.net,1337,2025-01-12 15:00:09
955,Vero reiciendis beatae deserunt voluptas voluptas aliquam.,mod@musedmx.com,1,3,juan-carlos74@example.com,1337,2025-05-13 17:51:18
956,Quisquam consequatur harum eum.,mod@musedmx.com,1,1,lilia68@example.org,1337,2025-05-30 12:08:54
957,Tempora vitae voluptatibus at in repellat earum error in.,mod@musedmx.com,1,4,xmeraz@example.net,1337,2025-04-30 04:55:10
958,Tempora odio nesciunt quibusdam nam ullam.,mod@musedmx.com,1,4,yzamora@example.org,1337,2025-04-13 15:57:10
959,Enim explicabo ad cupiditate eveniet.,mod@musedmx.com,1,4,pinedaaldo@example.com,1337,2025-04-08 19:29:04
960,Sint facere nemo unde molestias deleniti eius quasi suscipit.,mod@musedmx.com,1,2,gbriseno@example.net,1337,2025-01-03 03:22:44
961,Quod ipsa cumque voluptatum maxime.,mod@musedmx.com,1,4,ttoro@example.com,1337,2025-04-10 18:53:54
962,Magnam est officiis delectus.,mod@musedmx.com,1,5,carrillodaniel@example.net,1337,2025-05-31 08:09:46
963,Consectetur sapiente voluptatum nostrum dolorem magnam dolore possimus consequatur.,mod@musedmx.com,1,2,frida66@example.net,1337,2025-01-13 00:05:51
964,Possimus animi cupiditate distinctio nostrum et magni eos incidunt architecto.,mod@musedmx.com,1,1,leonor86@example.com,1337,2025-04-22 12:21:23
965,Harum eaque necessitatibus quia error laudantium omnis.,mod@musedmx.com,1,3,villegasvictor@example.org,1337,2025-05-07 15:35:44
966,Velit voluptatem a ab ea nemo culpa.,mod@musedmx.com,1,3,armando38@example.net,1337,2025-05-30 01:06:58
967,Ipsam nam sit quaerat veritatis ducimus qui.,mod@musedmx.com,1,5,omar70@example.com,1337,2025-01-30 03:52:43
968,Cumque quo quis voluptatem veniam laboriosam quae culpa culpa.,mod@musedmx.com,1,4,aangulo@example.com,1337,2025-05-01 01:32:11
969,Sed ratione illo velit perferendis illo commodi harum.,mod@musedmx.com,1,3,mgastelum@example.net,1337,2025-02-28 15:19:05
970,Assumenda nam libero totam nisi incidunt debitis voluptate.,mod@musedmx.com,1,2,lalonso@example.com,1337,2025-01-24 05:33:27
971,Modi animi dolorem in assumenda voluptatem.,mod@musedmx.com,1,2,holguinasuncion@example.com,1337,2025-05-21 11:33:08
972,Odit tempore quae nostrum id error quisquam repudiandae sit fuga.,mod@musedmx.com,1,4,raquel03@example.org,1337,2025-03-10 03:05:56
973,Odio consectetur quo perspiciatis iusto sapiente ducimus ducimus natus sapiente.,mod@musedmx.com,1,1,rodolfo82@example.org,1337,2025-02-18 23:15:08
974,Consectetur quia dolores dicta repudiandae autem natus sequi occaecati ad consequatur.,mod@musedmx.com,1,2,mariano37@example.com,1337,2025-03-01 23:42:07
975,Nisi accusamus iusto voluptas quis ea iure.,mod@musedmx.com,1,4,cesarbatista@example.net,1337,2025-03-07 14:07:32
976,Corrupti eum a rem voluptatem pariatur debitis vel nostrum nihil.,mod@musedmx.com,1,3,vergaraadalberto@example.org,1337,2025-04-19 22:39:05
977,Doloribus excepturi porro quia ut maxime provident.,mod@musedmx.com,1,5,tsosa@example.net,1337,2025-03-14 23:38:42
978,Cupiditate vitae officiis repellat error at nihil sit beatae quidem.,mod@musedmx.com,1,5,centenodiego@example.net,1337,2025-01-12 01:53:59
979,Nihil animi iusto iure id quo quis ut.,mod@musedmx.com,1,1,emilia50@example.net,1337,2025-05-18 01:04:24
980,Est cum sit odit placeat veritatis nihil sit debitis excepturi.,mod@musedmx.com,1,3,mamador@example.com,1337,2025-01-18 09:47:54
981,Consequuntur et officia amet debitis minima quibusdam velit perspiciatis.,mod@musedmx.com,1,1,tomas41@example.net,1337,2025-01-16 11:49:06
982,Sunt corporis eius quia saepe deserunt fuga.,mod@musedmx.com,1,5,luis-manuel57@example.com,1337,2025-02-07 22:02:36
983,Ad dolores ex at adipisci ipsum laudantium odio quidem adipisci.,mod@musedmx.com,1,3,karinaquesada@example.org,1337,2025-04-21 14:03:09
984,Aspernatur praesentium iste dicta ut alias.,mod@musedmx.com,1,1,luis-miguel95@example.org,1337,2025-05-16 11:49:44
985,Consequuntur nemo incidunt a quas omnis corrupti laboriosam placeat voluptatum mollitia.,mod@musedmx.com,1,4,menapilar@example.net,1337,2025-06-02 15:25:29
986,Doloribus porro dolore impedit nihil.,mod@musedmx.com,1,2,rebeca85@example.org,1337,2025-03-22 01:50:17
987,Illum laboriosam praesentium ex impedit eligendi suscipit reprehenderit exercitationem sed.,mod@musedmx.com,1,5,itzelcepeda@example.net,1337,2025-05-29 01:46:59
988,Consequatur ad veniam totam ipsa adipisci vel magnam minima id excepturi.,mod@musedmx.com,1,1,wjurado@example.com,1337,2025-05-16 16:25:40
989,Sapiente reiciendis inventore voluptates maiores quas quibusdam nobis.,mod@musedmx.com,1,5,oalmonte@example.org,1337,2025-02-05 11:08:10
990,A optio voluptas iusto ad dignissimos dicta corrupti voluptatum quisquam.,mod@musedmx.com,1,5,pchavarria@example.com,1337,2025-05-08 23:40:18
991,Unde dolore ut quidem id recusandae voluptates amet vitae.,mod@musedmx.com,1,3,tvillagomez@example.net,1337,2025-01-27 11:24:40
992,Debitis doloribus tempora quos sint ea.,mod@musedmx.com,1,5,helenaestrada@example.com,1337,2025-05-22 01:03:55
993,Commodi inventore corrupti sapiente veniam.,mod@musedmx.com,1,2,delia78@example.com,1337,2025-03-02 19:14:14
994,Eius fugiat animi consequatur temporibus qui.,mod@musedmx.com,1,2,isabelrosales@example.com,1337,2025-01-31 11:44:41
995,Veniam commodi nostrum deleniti.,mod@musedmx.com,1,3,ffonseca@example.net,1337,2025-04-18 20:24:45
996,In qui dolor dolor recusandae occaecati architecto placeat deserunt.,mod@musedmx.com,1,2,raulrosas@example.org,1337,2025-05-28 04:28:57
997,Corrupti veritatis sequi explicabo impedit a.,mod@musedmx.com,1,5,psaldivar@example.com,1337,2025-05-14 10:54:52
998,Similique ipsa modi quibusdam laborum esse aperiam sit minima sit.,mod@musedmx.com,1,5,jose-mariacollado@example.net,1337,2025-01-27 13:21:35
999,Eligendi eaque soluta deserunt iste facere.,mod@musedmx.com,1,3,regaladomaximiliano@example.com,1337,2025-05-05 23:39:43
1000,Explicabo harum veniam blanditiis quisquam soluta distinctio modi maxime atque.,mod@musedmx.com,1,3,luisaalcantar@example.com,1337,2025-05-18 08:36:58
1001,Occaecati neque rem voluptatum sit in.,mod@musedmx.com,1,4,modesto43@example.org,757,2025-01-11 11:12:31
1002,Quod eius fuga totam voluptatum tenetur iure laudantium rerum fuga.,mod@musedmx.com,1,4,teresa91@example.org,757,2025-02-25 05:08:32
1003,Inventore suscipit debitis autem.,mod@musedmx.com,1,3,aracelide-leon@example.org,757,2025-05-30 21:59:15
1004,Magni nam laborum dignissimos itaque dicta aut totam.,mod@musedmx.com,1,1,oscarbetancourt@example.com,757,2025-05-09 23:01:15
1005,Odit molestias quo laborum ipsum harum veniam hic recusandae cupiditate.,mod@musedmx.com,1,1,normavillareal@example.net,757,2025-05-09 20:06:20
1006,Eaque modi dicta perferendis explicabo temporibus molestias tempora quia.,mod@musedmx.com,1,2,roybalestela@example.net,757,2025-05-16 16:13:18
1007,Neque necessitatibus laboriosam similique unde natus.,mod@musedmx.com,1,5,ysamaniego@example.org,757,2025-02-21 11:46:29
1008,Eligendi officiis nihil minus culpa amet.,mod@musedmx.com,1,2,adelaroybal@example.com,757,2025-03-17 01:02:04
