res_id_res,res_comentario,res_mod_correo,res_aprobado,res_calif_estrellas,visitas_vi_usr_correo,visitas_vi_mus_id,visitas_vi_fechahora
1804,Sequi beatae itaque odio voluptatem atque porro accusantium.,mod@musedmx.com,1,2,oscarbetancourt@example.com,403,2025-04-08 23:41:09
1805,Quam voluptate unde quia ducimus possimus.,mod@musedmx.com,1,2,normavillareal@example.net,403,2025-02-25 10:18:12
1806,Sit eius quo numquam libero praesentium cum repellat aperiam tempore.,mod@musedmx.com,1,2,roybalestela@example.net,403,2025-04-11 15:56:14
1807,Dolor minima veritatis explicabo voluptatibus magni perferendis sint.,mod@musedmx.com,1,3,ysamaniego@example.org,403,2025-03-19 00:02:57
1808,Possimus quaerat optio occaecati sequi qui dignissimos odit.,mod@musedmx.com,1,3,adelaroybal@example.com,403,2025-05-21 01:41:59
1809,Exercitationem cupiditate iusto nesciunt expedita quisquam.,mod@musedmx.com,1,5,gmadera@example.org,403,2025-03-10 20:52:43
1810,Veritatis odio rerum qui doloribus.,mod@musedmx.com,1,4,irosas@example.com,403,2025-04-14 20:17:51
1811,Voluptate minima animi odit vero molestiae.,mod@musedmx.com,1,4,esther14@example.com,403,2025-04-19 10:11:33
1812,Ea hic ipsum tempora itaque itaque at esse.,mod@musedmx.com,1,1,paola60@example.org,403,2025-01-11 02:59:41
1813,Minima dolorem iure cumque amet fuga.,mod@musedmx.com,1,1,lorenzopuente@example.org,403,2025-01-16 10:28:33
1814,Debitis beatae at at quasi.,mod@musedmx.com,1,2,ccandelaria@example.org,403,2025-03-12 03:46:09
1815,Praesentium possimus amet quisquam ipsa.,mod@musedmx.com,1,1,ecalderon@example.net,403,2025-01-07 22:43:42
1816,Quasi cum doloribus voluptates vero voluptatibus nulla illum beatae reiciendis.,mod@musedmx.com,1,5,qapodaca@example.org,403,2025-05-31 03:31:58
1817,Iure fuga enim repellat totam non facere inventore facere distinctio unde.,mod@musedmx.com,1,4,valejandro@example.org,403,2025-01-14 16:52:16
1818,Minima in corrupti facere.,mod@musedmx.com,1,4,esteban04@example.net,403,2025-05-10 16:16:04
1819,Dicta ratione porro hic exercitationem sed facilis dicta.,mod@musedmx.com,1,2,granadoesparta@example.net,403,2025-04-28 04:32:02
1820,Natus hic aut nostrum culpa ratione possimus accusamus sit similique nostrum.,mod@musedmx.com,1,3,del-rioabigail@example.org,403,2025-03-15 10:14:17
1821,Non aliquid error nostrum consequuntur.,mod@musedmx.com,1,1,jgalarza@example.net,403,2025-04-11 06:36:07
1822,Amet sapiente ex dolorem quidem earum porro error.,mod@musedmx.com,1,1,qcolunga@example.com,403,2025-03-06 09:34:47
1823,Totam blanditiis inventore exercitationem necessitatibus.,mod@musedmx.com,1,4,joaquinleon@example.net,403,2025-05-28 04:35:42
1824,Odit sapiente fugit nobis.,mod@musedmx.com,1,1,olivia36@example.org,403,2025-05-01 11:09:59
1825,Sint numquam perspiciatis ex officiis saepe.,mod@musedmx.com,1,4,eloy78@example.net,403,2025-03-21 12:58:44
1826,In iusto nemo consequatur doloribus sapiente ut.,mod@musedmx.com,1,5,ivancasanova@example.com,403,2025-05-19 11:55:27
1827,Ut odit sapiente sequi ad qui ratione necessitatibus.,mod@musedmx.com,1,4,anel09@example.com,403,2025-05-09 07:39:29
1828,Unde voluptatem alias soluta quas dicta.,mod@musedmx.com,1,2,caballerojulio@example.com,403,2025-01-04 04:46:58
1829,Sapiente reiciendis illum necessitatibus qui nulla vitae maiores ratione.,mod@musedmx.com,1,3,rufinodelgadillo@example.com,403,2025-05-10 22:14:01
1830,A asperiores nisi architecto quo provident repudiandae.,mod@musedmx.com,1,2,dulce55@example.com,403,2025-02-08 17:39:48
1831,Praesentium iusto ex saepe sequi aut.,mod@musedmx.com,1,5,iglesiashoracio@example.net,403,2025-04-05 19:30:25
1832,Qui quibusdam aliquam esse nihil.,mod@musedmx.com,1,1,acordero@example.com,403,2025-03-24 05:45:16
1833,Earum quas ab itaque perspiciatis voluptates incidunt iste.,mod@musedmx.com,1,2,sonia28@example.com,403,2025-05-12 14:45:31
1834,Vel dolor dolorum rem voluptas dicta sint fugiat ducimus excepturi.,mod@musedmx.com,1,2,fidel14@example.com,403,2025-05-09 14:44:11
1835,Iste repellat alias occaecati in ipsam tempore earum blanditiis accusantium.,mod@musedmx.com,1,4,rubyesparza@example.com,403,2025-02-01 18:15:34
1836,Dolore explicabo accusantium amet aliquam aliquid expedita et rerum inventore.,mod@musedmx.com,1,3,javier96@example.org,403,2025-01-26 10:37:48
1837,Tempore perspiciatis ratione laborum illum odit.,mod@musedmx.com,1,3,dgarza@example.com,403,2025-04-26 03:27:56
1838,Quibusdam fugit esse vitae explicabo quaerat culpa mollitia.,mod@musedmx.com,1,4,saldanasoledad@example.com,403,2025-04-12 02:42:33
1839,Quod sequi voluptas quam quia.,mod@musedmx.com,1,1,gracielacordova@example.net,403,2025-05-24 10:26:01
1840,Ex incidunt fugit beatae debitis omnis amet soluta aperiam cupiditate.,mod@musedmx.com,1,1,ytorres@example.com,403,2025-04-20 09:16:27
1841,Ullam est iste necessitatibus impedit neque.,mod@musedmx.com,1,2,rodolfo57@example.org,403,2025-03-26 20:50:29
1842,Numquam sint in quam voluptatem.,mod@musedmx.com,1,1,avilaenrique@example.net,403,2025-03-27 22:13:28
1843,Amet non necessitatibus quos non.,mod@musedmx.com,1,3,genaro38@example.org,403,2025-03-29 12:20:22
1844,Earum corporis dolore omnis impedit maxime tempora sapiente quis.,mod@musedmx.com,1,3,camilonava@example.com,403,2025-03-10 23:03:14
1845,Nam illo qui consequuntur quidem sed dolor.,mod@musedmx.com,1,2,maria-josepuga@example.com,403,2025-01-03 13:59:51
1846,Consectetur ducimus dolor corrupti blanditiis tenetur.,mod@musedmx.com,1,3,pcarvajal@example.net,403,2025-04-21 15:47:00
1847,Mollitia dolorem tenetur ea ducimus.,mod@musedmx.com,1,3,leonardochavarria@example.org,403,2025-01-05 06:17:51
1848,Illum in animi rem amet.,mod@musedmx.com,1,4,jose-emilio94@example.org,403,2025-06-01 10:27:33
1849,Numquam officiis a molestiae deleniti.,mod@musedmx.com,1,2,gsolorio@example.net,403,2025-01-08 21:42:10
1850,Dolores magni quos non consectetur dolores magni illo odio.,mod@musedmx.com,1,1,madridserafin@example.net,403,2025-04-05 05:56:02
1851,Voluptas eligendi laborum illo ratione officiis distinctio.,mod@musedmx.com,1,2,vmelgar@example.org,403,2025-02-11 13:49:53
1852,Ratione molestias et error.,mod@musedmx.com,1,2,ramosdaniela@example.org,403,2025-02-27 00:11:14
1853,Ab illo suscipit non voluptas ipsa odit exercitationem atque.,mod@musedmx.com,1,5,rosarioulloa@example.org,403,2025-04-03 00:09:37
1854,Cum dolores ipsum excepturi maiores eligendi.,mod@musedmx.com,1,2,luis-manuelpatino@example.net,403,2025-01-09 08:46:14
1855,Dignissimos ab doloremque pariatur saepe ut unde error repellendus.,mod@musedmx.com,1,2,juan-carlos74@example.com,403,2025-03-10 12:54:29
1856,Qui iure molestiae libero impedit facere dicta.,mod@musedmx.com,1,4,lilia68@example.org,403,2025-02-14 01:36:44
1857,Adipisci laborum dolore alias.,mod@musedmx.com,1,5,xmeraz@example.net,403,2025-03-06 12:50:02
1858,Explicabo exercitationem itaque distinctio sunt autem nihil excepturi reiciendis.,mod@musedmx.com,1,5,yzamora@example.org,403,2025-01-05 22:23:31
1859,Sequi sapiente quos ipsum voluptas iusto in delectus accusamus voluptatem.,mod@musedmx.com,1,1,pinedaaldo@example.com,403,2025-04-11 00:28:35
1860,Voluptates neque a blanditiis quod sit.,mod@musedmx.com,1,4,gbriseno@example.net,403,2025-03-10 15:53:31
1861,Harum adipisci qui distinctio aliquid optio dolores.,mod@musedmx.com,1,5,ttoro@example.com,403,2025-01-22 15:04:12
1862,Officiis aperiam iusto hic placeat occaecati libero.,mod@musedmx.com,1,2,carrillodaniel@example.net,403,2025-03-05 10:41:29
1863,Perspiciatis nisi aliquid beatae doloribus.,mod@musedmx.com,1,2,frida66@example.net,403,2025-03-05 21:19:26
1864,Quibusdam eum perspiciatis deserunt sequi a.,mod@musedmx.com,1,5,leonor86@example.com,403,2025-05-24 22:27:49
1865,Dolor est illo recusandae delectus doloribus libero.,mod@musedmx.com,1,4,villegasvictor@example.org,403,2025-01-19 13:00:41
1866,Ex vero a fuga odit.,mod@musedmx.com,1,4,armando38@example.net,403,2025-04-11 16:17:30
1867,Error distinctio ad amet autem.,mod@musedmx.com,1,4,omar70@example.com,403,2025-05-18 13:25:07
1868,Corporis aspernatur suscipit omnis nemo dolorem omnis.,mod@musedmx.com,1,5,aangulo@example.com,403,2025-02-01 11:16:46
1869,Minus velit iure libero.,mod@musedmx.com,1,1,mgastelum@example.net,403,2025-03-20 12:06:05
1870,Libero eum laborum cupiditate perferendis perferendis.,mod@musedmx.com,1,4,lalonso@example.com,403,2025-04-05 17:51:09
1871,Amet quae minima perspiciatis.,mod@musedmx.com,1,2,holguinasuncion@example.com,403,2025-05-29 04:56:53
1872,Sequi earum quia a quisquam praesentium rem aut.,mod@musedmx.com,1,5,raquel03@example.org,403,2025-04-06 08:48:28
1873,Et possimus tenetur blanditiis excepturi voluptatibus ad alias.,mod@musedmx.com,1,3,rodolfo82@example.org,403,2025-05-23 00:21:59
1874,Asperiores necessitatibus veritatis a aliquid dicta sunt voluptates soluta.,mod@musedmx.com,1,3,mariano37@example.com,403,2025-01-17 03:07:55
1875,Inventore dignissimos repellendus libero magnam inventore.,mod@musedmx.com,1,5,cesarbatista@example.net,403,2025-04-14 04:10:10
1876,Molestias reprehenderit rem voluptatum impedit est eius corporis.,mod@musedmx.com,1,1,vergaraadalberto@example.org,403,2025-05-24 07:19:04
1877,Repellendus blanditiis rem quos veniam ipsam voluptas asperiores fugit cumque.,mod@musedmx.com,1,4,tsosa@example.net,403,2025-01-07 15:13:17
1878,Eveniet doloribus commodi laborum libero ut eaque aperiam officiis.,mod@musedmx.com,1,2,centenodiego@example.net,403,2025-05-12 11:41:18
1879,Labore numquam enim dolorem et id aut dolores perspiciatis numquam nesciunt.,mod@musedmx.com,1,1,emilia50@example.net,403,2025-03-02 06:39:40
1880,Iure pariatur beatae maxime sint.,mod@musedmx.com,1,5,mamador@example.com,403,2025-01-04 18:04:24
1881,Perspiciatis voluptates rerum tenetur facere.,mod@musedmx.com,1,3,tomas41@example.net,403,2025-03-28 05:41:46
1882,Molestias rem placeat totam cumque repudiandae architecto numquam esse.,mod@musedmx.com,1,1,luis-manuel57@example.com,403,2025-05-16 00:08:54
1883,Dolores nemo quisquam distinctio molestias ad deleniti deleniti cum.,mod@musedmx.com,1,2,karinaquesada@example.org,403,2025-05-04 09:32:31
1884,Numquam quibusdam error praesentium.,mod@musedmx.com,1,2,luis-miguel95@example.org,403,2025-04-10 02:00:27
1885,Explicabo quae saepe laboriosam iste tempora aut.,mod@musedmx.com,1,1,menapilar@example.net,403,2025-03-31 22:32:56
1886,Laborum sed sapiente magnam at nihil nobis suscipit.,mod@musedmx.com,1,5,rebeca85@example.org,403,2025-04-07 05:24:41
1887,Nesciunt fugit distinctio quasi.,mod@musedmx.com,1,1,itzelcepeda@example.net,403,2025-05-21 07:40:38
1888,Facilis ea non iure recusandae.,mod@musedmx.com,1,1,wjurado@example.com,403,2025-03-23 08:55:22
1889,Dolorum similique odio incidunt vel porro deserunt harum atque dolorum.,mod@musedmx.com,1,5,oalmonte@example.org,403,2025-02-26 18:10:39
1890,Quod quis ipsa facere tempora.,mod@musedmx.com,1,4,pchavarria@example.com,403,2025-02-02 22:46:28
1891,Nihil quo unde ab provident nisi ratione culpa asperiores tempore.,mod@musedmx.com,1,2,tvillagomez@example.net,403,2025-02-25 20:30:45
1892,Optio totam labore voluptatibus.,mod@musedmx.com,1,1,helenaestrada@example.com,403,2025-03-12 10:16:23
1893,Ipsam atque modi odio voluptatum repellendus.,mod@musedmx.com,1,1,delia78@example.com,403,2025-03-30 14:07:22
1894,Eveniet deleniti alias pariatur.,mod@musedmx.com,1,1,isabelrosales@example.com,403,2025-05-02 15:29:45
1895,Sit deserunt provident labore distinctio harum.,mod@musedmx.com,1,3,ffonseca@example.net,403,2025-05-11 16:08:40
1896,Illum veritatis debitis quidem omnis.,mod@musedmx.com,1,2,raulrosas@example.org,403,2025-03-09 10:45:27
1897,Voluptates provident aperiam ipsum modi dignissimos iusto eveniet.,mod@musedmx.com,1,5,psaldivar@example.com,403,2025-01-13 23:12:09
1898,Illo atque omnis voluptas excepturi asperiores.,mod@musedmx.com,1,2,jose-mariacollado@example.net,403,2025-04-02 10:54:28
1899,Perferendis tenetur aut sapiente provident.,mod@musedmx.com,1,2,regaladomaximiliano@example.com,403,2025-03-12 23:08:02
1900,Sed asperiores quo deserunt enim soluta unde quidem labore.,mod@musedmx.com,1,2,luisaalcantar@example.com,403,2025-03-03 16:35:09
1901,Voluptates unde dolores repellendus nam at asperiores eveniet.,mod@musedmx.com,1,1,modesto43@example.org,1109,2025-01-20 11:44:01
1902,A voluptate nobis laudantium aliquid harum.,mod@musedmx.com,1,5,teresa91@example.org,1109,2025-03-13 23:31:45
1903,Voluptatem est ab at aut.,mod@musedmx.com,1,5,aracelide-leon@example.org,1109,2025-04-10 20:57:12
1904,Corrupti quos beatae itaque ipsam quia.,mod@musedmx.com,1,3,oscarbetancourt@example.com,1109,2025-01-29 12:56:11
1905,Voluptates mollitia nostrum quae mollitia tempora possimus eaque.,mod@musedmx.com,1,1,normavillareal@example.net,1109,2025-04-26 20:46:18
1906,Exercitationem omnis eaque eum reiciendis.,mod@musedmx.com,1,2,roybalestela@example.net,1109,2025-06-01 07:50:08
1907,Culpa consequuntur itaque eligendi dolor suscipit fugiat accusamus debitis cum.,mod@musedmx.com,1,5,ysamaniego@example.org,1109,2025-04-21 21:11:55
1908,Aperiam veniam officiis rerum.,mod@musedmx.com,1,3,adelaroybal@example.com,1109,2025-03-20 00:24:58
1909,Reprehenderit voluptas sapiente consequuntur libero rem architecto veritatis.,mod@musedmx.com,1,1,gmadera@example.org,1109,2025-01-18 21:27:33
1910,Et similique omnis fugiat assumenda ad.,mod@musedmx.com,1,4,irosas@example.com,1109,2025-05-01 08:12:11
1911,Culpa laboriosam autem expedita animi voluptatum repudiandae consectetur at.,mod@musedmx.com,1,2,esther14@example.com,1109,2025-05-26 20:54:12
1912,Ducimus vitae amet eligendi dolorum est.,mod@musedmx.com,1,3,paola60@example.org,1109,2025-04-25 16:29:58
1913,Ipsam aliquid nemo vitae et aut.,mod@musedmx.com,1,3,lorenzopuente@example.org,1109,2025-05-28 10:51:27
1914,Inventore vero sunt officiis commodi.,mod@musedmx.com,1,1,ccandelaria@example.org,1109,2025-03-12 13:50:01
1915,Ea corrupti cum sapiente distinctio sit non eos illo quod.,mod@musedmx.com,1,1,ecalderon@example.net,1109,2025-04-03 09:21:23
1916,Omnis perspiciatis autem at doloremque dolores laudantium aspernatur at.,mod@musedmx.com,1,2,qapodaca@example.org,1109,2025-01-18 06:09:36
1917,Ad quidem veniam eaque ad.,mod@musedmx.com,1,3,valejandro@example.org,1109,2025-02-25 08:17:38
1918,Culpa optio magni animi quidem totam.,mod@musedmx.com,1,4,esteban04@example.net,1109,2025-05-21 22:31:11
1919,Tempora adipisci veritatis nesciunt exercitationem.,mod@musedmx.com,1,5,granadoesparta@example.net,1109,2025-05-15 08:10:05
1920,Non neque laboriosam repudiandae odio vero ut sunt libero aut.,mod@musedmx.com,1,2,del-rioabigail@example.org,1109,2025-04-17 15:42:00
1921,Perspiciatis eos eos reprehenderit voluptas.,mod@musedmx.com,1,1,jgalarza@example.net,1109,2025-05-05 08:31:22
1922,Aperiam laborum aperiam in aliquam iure quasi possimus.,mod@musedmx.com,1,1,qcolunga@example.com,1109,2025-04-04 06:34:55
1923,Optio ea exercitationem eaque quam omnis fuga explicabo.,mod@musedmx.com,1,1,joaquinleon@example.net,1109,2025-05-22 13:38:50
1924,Debitis exercitationem excepturi ab et nam corporis molestiae similique earum.,mod@musedmx.com,1,2,olivia36@example.org,1109,2025-01-19 15:53:47
1925,Enim suscipit dolor dignissimos corporis.,mod@musedmx.com,1,2,eloy78@example.net,1109,2025-04-29 02:20:05
1926,Magnam fugit saepe voluptatibus commodi eum architecto.,mod@musedmx.com,1,2,ivancasanova@example.com,1109,2025-03-05 20:49:46
1927,Quibusdam consequuntur quia voluptatum sapiente alias doloremque labore vel provident.,mod@musedmx.com,1,2,anel09@example.com,1109,2025-03-02 16:45:25
1928,Eos vel voluptates consectetur ipsum incidunt voluptate fugiat esse.,mod@musedmx.com,1,5,caballerojulio@example.com,1109,2025-01-08 11:45:24
1929,Beatae aliquam neque adipisci dolorum ex pariatur voluptate corrupti fugiat perferendis.,mod@musedmx.com,1,3,rufinodelgadillo@example.com,1109,2025-04-19 04:27:52
1930,Consectetur animi neque tempore voluptatibus laborum.,mod@musedmx.com,1,5,dulce55@example.com,1109,2025-04-18 23:57:05
1931,Ducimus quam eveniet repellat eos quam.,mod@musedmx.com,1,5,iglesiashoracio@example.net,1109,2025-03-13 12:37:10
1932,Incidunt consequatur repellat dicta magnam similique.,mod@musedmx.com,1,3,acordero@example.com,1109,2025-01-30 06:13:47
1933,Voluptas esse perspiciatis sapiente blanditiis impedit occaecati necessitatibus.,mod@musedmx.com,1,3,sonia28@example.com,1109,2025-05-25 15:09:59
1934,Iusto eius eum ipsam numquam.,mod@musedmx.com,1,5,fidel14@example.com,1109,2025-01-30 10:52:02
1935,Qui pariatur aliquid suscipit harum a reiciendis officiis molestias.,mod@musedmx.com,1,5,rubyesparza@example.com,1109,2025-05-11 11:14:31
1936,Quaerat ipsam aspernatur sunt dolorum dolorum natus quaerat ratione odio voluptatem.,mod@musedmx.com,1,4,javier96@example.org,1109,2025-01-14 11:37:28
1937,Nulla corporis temporibus mollitia ipsum eum vel dolorem ad totam voluptas.,mod@musedmx.com,1,5,dgarza@example.com,1109,2025-05-17 10:22:45
1938,Possimus ipsum ut tempora pariatur.,mod@musedmx.com,1,5,saldanasoledad@example.com,1109,2025-02-02 22:58:47
1939,Pariatur aliquid qui neque eum est.,mod@musedmx.com,1,4,gracielacordova@example.net,1109,2025-04-29 20:31:09
1940,Possimus deserunt quos quasi illum ducimus eum quam incidunt.,mod@musedmx.com,1,3,ytorres@example.com,1109,2025-05-13 01:37:37
1941,Officiis cupiditate laudantium sit deserunt tempore nulla illum.,mod@musedmx.com,1,1,rodolfo57@example.org,1109,2025-02-09 17:32:30
1942,Non soluta repudiandae nostrum delectus iste sunt deleniti.,mod@musedmx.com,1,1,avilaenrique@example.net,1109,2025-04-27 15:56:54
1943,Eaque quam doloribus quam deserunt quas.,mod@musedmx.com,1,2,genaro38@example.org,1109,2025-01-02 11:39:31
1944,Consequatur nesciunt totam corrupti repellendus iste.,mod@musedmx.com,1,4,camilonava@example.com,1109,2025-06-04 23:43:41
1945,Deleniti eum quasi fugiat ipsam labore iure aliquid.,mod@musedmx.com,1,1,maria-josepuga@example.com,1109,2025-05-17 22:11:10
1946,Vitae expedita quidem vel veritatis.,mod@musedmx.com,1,3,pcarvajal@example.net,1109,2025-05-06 07:32:49
1947,Dolore error commodi temporibus in fuga velit cum.,mod@musedmx.com,1,4,leonardochavarria@example.org,1109,2025-05-16 20:00:30
1948,Consequatur quae quo placeat ex labore dignissimos consequuntur ullam.,mod@musedmx.com,1,1,jose-emilio94@example.org,1109,2025-01-28 21:38:11
1949,Quae quasi qui dolorem quasi.,mod@musedmx.com,1,1,gsolorio@example.net,1109,2025-04-25 16:32:55
1950,Eos consequuntur quasi doloremque quam animi iusto ullam amet officia doloremque.,mod@musedmx.com,1,3,madridserafin@example.net,1109,2025-05-06 02:38:25
1951,Sint optio pariatur dolores hic eaque sapiente.,mod@musedmx.com,1,5,vmelgar@example.org,1109,2025-03-06 18:05:27
1952,Voluptatibus provident corrupti voluptatem iusto ratione sunt mollitia nihil.,mod@musedmx.com,1,4,ramosdaniela@example.org,1109,2025-06-02 14:41:49
1953,Sunt temporibus deserunt totam eaque aperiam.,mod@musedmx.com,1,5,rosarioulloa@example.org,1109,2025-02-22 07:42:28
1954,Quas provident modi veniam dignissimos quos animi.,mod@musedmx.com,1,5,luis-manuelpatino@example.net,1109,2025-06-01 03:45:08
1955,Facere nemo vitae officia molestiae eius sint nobis earum commodi.,mod@musedmx.com,1,2,juan-carlos74@example.com,1109,2025-04-06 08:02:48
1956,Distinctio provident nihil voluptate occaecati aliquid nam voluptate ipsum.,mod@musedmx.com,1,4,lilia68@example.org,1109,2025-03-06 19:33:01
1957,Laboriosam totam et animi eum mollitia doloribus.,mod@musedmx.com,1,5,xmeraz@example.net,1109,2025-03-16 12:24:49
1958,Minima blanditiis fuga error doloribus harum.,mod@musedmx.com,1,2,yzamora@example.org,1109,2025-02-01 05:31:00
1959,Distinctio corrupti deserunt aliquid velit harum et vel.,mod@musedmx.com,1,5,pinedaaldo@example.com,1109,2025-02-21 18:26:52
1960,Itaque nihil corporis exercitationem cupiditate necessitatibus modi et nostrum eaque.,mod@musedmx.com,1,2,gbriseno@example.net,1109,2025-04-23 01:34:21
1961,Quisquam at ipsum ipsa necessitatibus est corporis maxime provident.,mod@musedmx.com,1,5,ttoro@example.com,1109,2025-04-29 13:17:27
1962,Fugit eum neque aliquam eius velit rerum.,mod@musedmx.com,1,1,carrillodaniel@example.net,1109,2025-03-10 00:55:31
1963,Illum ab repudiandae soluta a saepe impedit deserunt id vel.,mod@musedmx.com,1,1,frida66@example.net,1109,2025-02-12 23:39:48
1964,Quos vel eaque omnis repudiandae.,mod@musedmx.com,1,5,leonor86@example.com,1109,2025-02-22 08:11:43
1965,Blanditiis natus at voluptatum debitis at quisquam quisquam.,mod@musedmx.com,1,4,villegasvictor@example.org,1109,2025-03-15 13:23:41
1966,Nesciunt ab ipsa nulla magnam voluptates.,mod@musedmx.com,1,2,armando38@example.net,1109,2025-03-30 05:15:25
1967,Natus repellat quo aperiam dolore excepturi.,mod@musedmx.com,1,1,omar70@example.com,1109,2025-01-11 15:11:40
1968,Quasi dolorum natus eveniet qui omnis maxime accusantium.,mod@musedmx.com,1,2,aangulo@example.com,1109,2025-01-28 21:50:49
1969,Animi neque dicta voluptate atque quam adipisci quaerat occaecati nemo.,mod@musedmx.com,1,1,mgastelum@example.net,1109,2025-05-22 00:21:48
1970,Vero mollitia exercitationem voluptatibus consectetur odio ratione nostrum.,mod@musedmx.com,1,1,lalonso@example.com,1109,2025-03-12 15:26:50
1971,Autem atque reprehenderit ea atque odit.,mod@musedmx.com,1,2,holguinasuncion@example.com,1109,2025-03-28 07:32:15
1972,Doloremque eveniet reprehenderit exercitationem veniam quam ad.,mod@musedmx.com,1,5,raquel03@example.org,1109,2025-05-03 04:47:19
1973,Amet adipisci minima dolores deserunt.,mod@musedmx.com,1,3,rodolfo82@example.org,1109,2025-05-18 15:19:58
1974,Blanditiis quaerat laboriosam possimus eum.,mod@musedmx.com,1,4,mariano37@example.com,1109,2025-01-05 18:16:57
1975,Officia perspiciatis voluptates tenetur quasi porro numquam hic temporibus tenetur deleniti.,mod@musedmx.com,1,3,cesarbatista@example.net,1109,2025-02-27 08:38:35
1976,Culpa et reiciendis earum qui voluptatem corrupti ducimus.,mod@musedmx.com,1,2,vergaraadalberto@example.org,1109,2025-03-29 11:42:13
1977,Deleniti adipisci nostrum nulla officiis maiores.,mod@musedmx.com,1,4,tsosa@example.net,1109,2025-01-02 20:05:14
1978,Nesciunt asperiores vitae blanditiis adipisci quo.,mod@musedmx.com,1,4,centenodiego@example.net,1109,2025-03-17 11:41:48
1979,Eos harum fugiat aliquid cupiditate.,mod@musedmx.com,1,5,emilia50@example.net,1109,2025-01-12 11:06:37
1980,Doloremque cupiditate nihil autem accusamus qui blanditiis tempora.,mod@musedmx.com,1,3,mamador@example.com,1109,2025-02-10 11:48:35
1981,Aperiam exercitationem ut tenetur mollitia sapiente.,mod@musedmx.com,1,5,tomas41@example.net,1109,2025-04-30 06:06:02
1982,Ad ut excepturi unde veniam perferendis illo at placeat soluta.,mod@musedmx.com,1,3,luis-manuel57@example.com,1109,2025-04-04 23:59:26
1983,Quasi quisquam dignissimos ipsa fugit.,mod@musedmx.com,1,4,karinaquesada@example.org,1109,2025-03-14 08:19:48
1984,Quae itaque aperiam optio facere error soluta eius excepturi reiciendis.,mod@musedmx.com,1,2,luis-miguel95@example.org,1109,2025-01-25 17:40:21
1985,Asperiores repudiandae totam veniam tenetur iusto tenetur dolores ipsum assumenda.,mod@musedmx.com,1,3,menapilar@example.net,1109,2025-05-22 21:10:09
1986,Et totam aperiam exercitationem officiis sint et numquam molestias dolores.,mod@musedmx.com,1,2,rebeca85@example.org,1109,2025-02-03 04:15:30
1987,Suscipit in quasi quas sed tenetur repudiandae numquam iste magni.,mod@musedmx.com,1,3,itzelcepeda@example.net,1109,2025-02-05 19:57:35
1988,Quos aspernatur fugiat perspiciatis mollitia tempore provident aliquam ea.,mod@musedmx.com,1,4,wjurado@example.com,1109,2025-05-05 12:18:34
1989,Dolor voluptatum eius reprehenderit delectus magnam.,mod@musedmx.com,1,5,oalmonte@example.org,1109,2025-06-02 11:46:55
1990,Beatae sint sunt sequi tempora aperiam iusto corrupti suscipit.,mod@musedmx.com,1,5,pchavarria@example.com,1109,2025-03-19 04:07:51
1991,Pariatur distinctio asperiores minima quisquam recusandae earum ab.,mod@musedmx.com,1,5,tvillagomez@example.net,1109,2025-03-23 20:57:23
1992,Aperiam praesentium eligendi dolore adipisci occaecati minus nulla corrupti.,mod@musedmx.com,1,4,helenaestrada@example.com,1109,2025-01-29 01:36:17
1993,Modi iure reprehenderit architecto autem unde expedita repudiandae iste.,mod@musedmx.com,1,2,delia78@example.com,1109,2025-05-05 06:29:43
1994,Alias omnis occaecati maiores ipsam sed optio.,mod@musedmx.com,1,3,isabelrosales@example.com,1109,2025-02-27 12:03:23
1995,Similique distinctio ea consectetur consequatur quas ea odio consectetur.,mod@musedmx.com,1,3,ffonseca@example.net,1109,2025-05-07 14:16:09
1996,Ab ullam perferendis iusto aliquid debitis at harum voluptatum ipsa.,mod@musedmx.com,1,4,raulrosas@example.org,1109,2025-01-15 11:40:18
1997,Eos id ducimus amet reprehenderit.,mod@musedmx.com,1,1,psaldivar@example.com,1109,2025-05-08 02:58:04
1998,Voluptatum soluta cum ratione numquam nobis eligendi optio.,mod@musedmx.com,1,2,jose-mariacollado@example.net,1109,2025-02-04 18:45:33
1999,Sit accusantium laborum temporibus harum culpa.,mod@musedmx.com,1,1,regaladomaximiliano@example.com,1109,2025-02-06 04:53:21
2000,Eius tempore corrupti odit inventore maxime.,mod@musedmx.com,1,3,luisaalcantar@example.com,1109,2025-01-07 06:54:17
2001,Et porro nisi vitae ipsum.,mod@musedmx.com,1,1,modesto43@example.org,710,2025-05-29 14:13:44
2002,Praesentium nostrum omnis et repudiandae suscipit molestias sapiente.,mod@musedmx.com,1,3,teresa91@example.org,710,2025-04-20 01:37:07
2003,Deleniti voluptatum expedita placeat occaecati necessitatibus.,mod@musedmx.com,1,1,aracelide-leon@example.org,710,2025-04-12 19:06:28
2004,Debitis quia reprehenderit totam soluta vel est error.,mod@musedmx.com,1,2,oscarbetancourt@example.com,710,2025-02-04 03:02:21
2005,Inventore voluptates animi inventore dolore.,mod@musedmx.com,1,4,normavillareal@example.net,710,2025-03-02 22:31:23
2006,Explicabo nemo laboriosam commodi.,mod@musedmx.com,1,4,roybalestela@example.net,710,2025-05-07 12:16:21
