res_id_res,res_comentario,res_mod_correo,res_aprobado,res_calif_estrellas,visitas_vi_usr_correo,visitas_vi_mus_id,visitas_vi_fechahora
2810,Nulla vitae reiciendis sunt temporibus laudantium alias recusandae.,mod@musedmx.com,1,4,irosas@example.com,707,2025-05-10 02:44:02
2811,Cum quos quidem odio cumque alias.,mod@musedmx.com,1,5,esther14@example.com,707,2025-03-17 17:13:38
2812,Culpa corrupti tempora nemo eaque a magnam magni nobis veniam consequatur.,mod@musedmx.com,1,3,paola60@example.org,707,2025-04-15 17:11:41
2813,Dolore facilis non magnam soluta soluta sint velit amet nobis.,mod@musedmx.com,1,3,lorenzopuente@example.org,707,2025-02-27 02:58:53
2814,Quae cupiditate ratione cupiditate facilis deserunt perferendis expedita maxime maxime.,mod@musedmx.com,1,5,ccandelaria@example.org,707,2025-04-27 19:23:36
2815,Modi corporis vitae at repellendus et vero dolores labore pariatur.,mod@musedmx.com,1,1,ecalderon@example.net,707,2025-04-12 12:39:45
2816,Aut rerum debitis temporibus quod natus dolorum.,mod@musedmx.com,1,4,qapodaca@example.org,707,2025-05-23 23:17:37
2817,Reiciendis sed dolorum itaque deleniti laboriosam dicta praesentium ut odit laudantium.,mod@musedmx.com,1,1,valejandro@example.org,707,2025-04-30 11:16:26
2818,Repellat praesentium reprehenderit ad blanditiis minus nostrum facilis.,mod@musedmx.com,1,4,esteban04@example.net,707,2025-01-25 20:11:21
2819,Dolor delectus autem vitae distinctio consequatur ducimus officiis doloremque.,mod@musedmx.com,1,4,granadoesparta@example.net,707,2025-05-28 03:18:52
2820,Modi ut voluptate esse asperiores sint laudantium ipsam.,mod@musedmx.com,1,1,del-rioabigail@example.org,707,2025-03-24 18:07:08
2821,Voluptatibus voluptates laudantium voluptatem facere recusandae quod recusandae quaerat facere molestias.,mod@musedmx.com,1,4,jgalarza@example.net,707,2025-01-27 04:37:29
2822,At voluptates quo fugit similique nemo nisi iusto totam.,mod@musedmx.com,1,4,qcolunga@example.com,707,2025-02-22 22:15:09
2823,Aliquid sunt ipsam totam exercitationem maiores totam ducimus dolore doloribus.,mod@musedmx.com,1,3,joaquinleon@example.net,707,2025-02-04 05:03:04
2824,Labore quod esse corporis sed.,mod@musedmx.com,1,5,olivia36@example.org,707,2025-05-01 22:56:36
2825,Inventore ab ducimus magnam labore ducimus odio occaecati at.,mod@musedmx.com,1,1,eloy78@example.net,707,2025-04-06 13:43:32
2826,Impedit commodi veritatis dolor impedit sit.,mod@musedmx.com,1,5,ivancasanova@example.com,707,2025-05-13 05:04:07
2827,Eligendi neque sed in aut laborum asperiores esse.,mod@musedmx.com,1,4,anel09@example.com,707,2025-04-04 09:04:44
2828,Illum accusantium tempora laborum ratione occaecati maxime distinctio.,mod@musedmx.com,1,5,caballerojulio@example.com,707,2025-01-19 09:41:27
2829,Illo fuga quis assumenda est ratione aspernatur architecto.,mod@musedmx.com,1,4,rufinodelgadillo@example.com,707,2025-03-01 02:46:32
2830,Quaerat consectetur perspiciatis eos voluptatem debitis ea sapiente porro ullam.,mod@musedmx.com,1,4,dulce55@example.com,707,2025-05-08 15:41:12
2831,Provident suscipit incidunt amet nesciunt quo dolores laudantium.,mod@musedmx.com,1,4,iglesiashoracio@example.net,707,2025-05-03 14:20:39
2832,Illum modi sunt doloremque esse qui omnis soluta.,mod@musedmx.com,1,4,acordero@example.com,707,2025-02-04 15:34:35
2833,Voluptatum nostrum quisquam doloremque molestias aperiam vitae.,mod@musedmx.com,1,4,sonia28@example.com,707,2025-01-19 20:59:36
2834,Error magnam quis dicta placeat aperiam.,mod@musedmx.com,1,3,fidel14@example.com,707,2025-04-24 00:58:14
2835,Fugit doloremque ipsum illum delectus praesentium expedita excepturi inventore.,mod@musedmx.com,1,1,rubyesparza@example.com,707,2025-03-21 22:34:28
2836,Autem voluptate a dignissimos eius nihil.,mod@musedmx.com,1,1,javier96@example.org,707,2025-03-10 11:28:05
2837,Omnis eligendi ipsa voluptatum labore consequuntur quisquam ullam neque.,mod@musedmx.com,1,3,dgarza@example.com,707,2025-04-18 07:36:18
2838,Aliquam minima fugiat fugit hic quam voluptatibus.,mod@musedmx.com,1,5,saldanasoledad@example.com,707,2025-01-04 21:53:00
2839,Aliquid culpa voluptas sed dicta perferendis.,mod@musedmx.com,1,2,gracielacordova@example.net,707,2025-03-20 10:01:25
2840,Quos ab recusandae corporis harum.,mod@musedmx.com,1,4,ytorres@example.com,707,2025-01-27 11:31:35
2841,Nihil dolores deleniti facere quibusdam mollitia eveniet aspernatur.,mod@musedmx.com,1,2,rodolfo57@example.org,707,2025-05-12 03:18:04
2842,Ipsum ut perspiciatis saepe officia veritatis.,mod@musedmx.com,1,1,avilaenrique@example.net,707,2025-05-26 04:22:51
2843,Quas tempore commodi voluptas provident voluptatum nesciunt explicabo alias assumenda.,mod@musedmx.com,1,5,genaro38@example.org,707,2025-04-14 00:37:22
2844,Natus nam blanditiis quasi maiores asperiores nobis.,mod@musedmx.com,1,2,camilonava@example.com,707,2025-01-05 11:26:11
2845,Incidunt expedita eaque sed cumque.,mod@musedmx.com,1,4,maria-josepuga@example.com,707,2025-05-12 06:47:15
2846,Fuga dignissimos explicabo explicabo inventore suscipit.,mod@musedmx.com,1,5,pcarvajal@example.net,707,2025-02-12 06:54:38
2847,Ipsum non commodi voluptas aperiam a labore consectetur tempora voluptate pariatur.,mod@musedmx.com,1,5,leonardochavarria@example.org,707,2025-06-05 09:02:42
2848,Quia praesentium placeat quidem magni vero nam architecto enim dolor.,mod@musedmx.com,1,1,jose-emilio94@example.org,707,2025-04-03 22:54:46
2849,Tempora odio molestiae laborum officiis vel odio saepe fuga.,mod@musedmx.com,1,3,gsolorio@example.net,707,2025-04-03 16:55:13
2850,Modi dicta ipsa optio sed debitis doloremque dicta iusto mollitia.,mod@musedmx.com,1,2,madridserafin@example.net,707,2025-01-08 07:34:57
2851,Quia quibusdam iure quas quia.,mod@musedmx.com,1,4,vmelgar@example.org,707,2025-01-07 16:16:57
2852,Tenetur eligendi suscipit quod cumque exercitationem.,mod@musedmx.com,1,5,ramosdaniela@example.org,707,2025-03-31 10:18:03
2853,Minus magnam similique aspernatur molestias labore.,mod@musedmx.com,1,4,rosarioulloa@example.org,707,2025-04-02 17:34:36
2854,Quas cupiditate fugiat sit ullam qui voluptate omnis reiciendis.,mod@musedmx.com,1,1,luis-manuelpatino@example.net,707,2025-03-18 07:33:24
2855,Quos commodi maiores tempore eum rerum pariatur ipsam veritatis quaerat.,mod@musedmx.com,1,3,juan-carlos74@example.com,707,2025-01-15 09:13:51
2856,Ipsa soluta accusantium adipisci quidem cum iure.,mod@musedmx.com,1,2,lilia68@example.org,707,2025-05-29 18:36:41
2857,Minima nostrum consectetur tenetur eos natus perspiciatis.,mod@musedmx.com,1,2,xmeraz@example.net,707,2025-04-15 06:05:57
2858,Dolorem ipsam eaque expedita veniam voluptates atque molestiae dolor.,mod@musedmx.com,1,5,yzamora@example.org,707,2025-04-30 17:00:47
2859,Inventore asperiores esse debitis sapiente doloribus quidem eum nesciunt.,mod@musedmx.com,1,3,pinedaaldo@example.com,707,2025-02-06 07:16:07
2860,Cupiditate similique repellat saepe fugit velit quidem praesentium atque neque.,mod@musedmx.com,1,5,gbriseno@example.net,707,2025-03-07 17:51:59
2861,Velit natus odit provident veritatis nihil dolores perferendis voluptates eaque.,mod@musedmx.com,1,5,ttoro@example.com,707,2025-01-23 17:24:40
2862,Aperiam omnis nostrum eaque soluta facilis.,mod@musedmx.com,1,3,carrillodaniel@example.net,707,2025-04-28 21:11:04
2863,Maxime voluptas dolores consequatur voluptatem adipisci.,mod@musedmx.com,1,3,frida66@example.net,707,2025-01-29 12:31:51
2864,Omnis fuga rem ducimus nostrum sapiente consequatur.,mod@musedmx.com,1,4,leonor86@example.com,707,2025-01-12 12:25:11
2865,Illo illo ullam ullam exercitationem qui.,mod@musedmx.com,1,5,villegasvictor@example.org,707,2025-05-31 08:55:38
2866,Et tempore nobis fuga.,mod@musedmx.com,1,5,armando38@example.net,707,2025-03-16 13:33:05
2867,Recusandae sequi ipsum deleniti eveniet unde optio.,mod@musedmx.com,1,4,omar70@example.com,707,2025-03-08 08:47:18
2868,Expedita iure veniam quae libero blanditiis.,mod@musedmx.com,1,3,aangulo@example.com,707,2025-05-05 08:19:54
2869,Quia molestias minima nisi.,mod@musedmx.com,1,1,mgastelum@example.net,707,2025-04-29 12:51:41
2870,Numquam alias aliquid cumque cupiditate facere ratione officiis dolorem aut minima.,mod@musedmx.com,1,4,lalonso@example.com,707,2025-01-12 09:43:59
2871,Debitis ut voluptatum nihil.,mod@musedmx.com,1,1,holguinasuncion@example.com,707,2025-01-19 14:08:47
2872,Esse aliquam voluptatibus iusto quibusdam architecto eligendi.,mod@musedmx.com,1,1,raquel03@example.org,707,2025-01-21 06:37:03
2873,Recusandae dolorum suscipit reiciendis ab tempora veritatis distinctio corporis beatae quam.,mod@musedmx.com,1,5,rodolfo82@example.org,707,2025-02-13 10:39:01
2874,Eum magni hic maiores rem.,mod@musedmx.com,1,3,mariano37@example.com,707,2025-04-21 20:09:43
2875,Rem quasi laudantium assumenda deserunt nesciunt possimus.,mod@musedmx.com,1,1,cesarbatista@example.net,707,2025-01-22 02:03:13
2876,Dolorum ratione nesciunt aperiam optio sunt corporis eius.,mod@musedmx.com,1,5,vergaraadalberto@example.org,707,2025-04-14 23:16:47
2877,Et rerum consectetur error amet quibusdam enim quae.,mod@musedmx.com,1,2,tsosa@example.net,707,2025-05-10 04:54:07
2878,Molestiae vitae aperiam libero dolor quibusdam possimus nisi accusamus eos.,mod@musedmx.com,1,2,centenodiego@example.net,707,2025-03-05 13:53:51
2879,Culpa id tenetur incidunt ducimus magnam consequatur exercitationem voluptatum cupiditate.,mod@musedmx.com,1,3,emilia50@example.net,707,2025-04-17 10:56:13
2880,Perspiciatis corporis ad recusandae.,mod@musedmx.com,1,5,mamador@example.com,707,2025-03-11 00:47:12
2881,Eos expedita necessitatibus nihil asperiores ab illo eveniet.,mod@musedmx.com,1,1,tomas41@example.net,707,2025-01-03 20:26:45
2882,Fuga assumenda error ullam eum adipisci.,mod@musedmx.com,1,2,luis-manuel57@example.com,707,2025-03-25 21:06:26
2883,Facilis voluptatem porro esse a.,mod@musedmx.com,1,4,karinaquesada@example.org,707,2025-05-26 20:55:10
2884,Numquam dolorum cum blanditiis impedit dolores.,mod@musedmx.com,1,2,luis-miguel95@example.org,707,2025-04-10 18:08:02
2885,Suscipit quae quam quasi sequi.,mod@musedmx.com,1,5,menapilar@example.net,707,2025-05-25 01:45:05
2886,Beatae blanditiis consectetur similique culpa.,mod@musedmx.com,1,5,rebeca85@example.org,707,2025-01-14 12:52:34
2887,Porro nulla ea voluptatibus rem.,mod@musedmx.com,1,3,itzelcepeda@example.net,707,2025-05-10 00:49:46
2888,Tempora accusamus ullam id pariatur beatae est molestiae assumenda itaque.,mod@musedmx.com,1,4,wjurado@example.com,707,2025-03-10 18:28:38
2889,Aperiam fugiat cumque dolores ab quisquam dignissimos.,mod@musedmx.com,1,3,oalmonte@example.org,707,2025-03-06 19:18:50
2890,Inventore eum illo voluptatum voluptatem.,mod@musedmx.com,1,5,pchavarria@example.com,707,2025-03-02 02:50:12
2891,Dignissimos eveniet harum velit cupiditate laboriosam illo fugit.,mod@musedmx.com,1,4,tvillagomez@example.net,707,2025-02-15 13:46:41
2892,At omnis illo sapiente distinctio cupiditate commodi suscipit laudantium odio.,mod@musedmx.com,1,4,helenaestrada@example.com,707,2025-04-28 11:54:26
2893,Sapiente est laboriosam nesciunt eaque.,mod@musedmx.com,1,2,delia78@example.com,707,2025-05-26 21:56:39
2894,Tenetur quibusdam nam quia totam ducimus.,mod@musedmx.com,1,2,isabelrosales@example.com,707,2025-04-14 18:24:06
2895,Aliquam qui eum quas fugit voluptatum explicabo similique expedita ut.,mod@musedmx.com,1,2,ffonseca@example.net,707,2025-02-24 00:25:39
2896,Eligendi incidunt voluptatibus sint assumenda consequuntur rerum necessitatibus.,mod@musedmx.com,1,2,raulrosas@example.org,707,2025-01-27 17:07:26
2897,Eveniet iure quas quos est et facilis labore at ea.,mod@musedmx.com,1,3,psaldivar@example.com,707,2025-01-29 10:42:22
2898,Recusandae debitis officiis modi officia quod.,mod@musedmx.com,1,4,jose-mariacollado@example.net,707,2025-01-08 03:27:32
2899,Nemo harum exercitationem aut soluta sunt non sunt debitis.,mod@musedmx.com,1,2,regaladomaximiliano@example.com,707,2025-03-29 11:44:48
2900,Eius deserunt quo sunt soluta.,mod@musedmx.com,1,3,luisaalcantar@example.com,707,2025-05-03 18:00:32
2901,Aspernatur fugiat sint temporibus natus dignissimos molestias quae omnis nostrum minima.,mod@musedmx.com,1,5,modesto43@example.org,1105,2025-03-14 03:53:06
2902,Iure eveniet quidem quae dolore quis voluptatem recusandae.,mod@musedmx.com,1,1,teresa91@example.org,1105,2025-04-07 03:33:23
2903,Eligendi dolorum modi porro nemo odit.,mod@musedmx.com,1,5,aracelide-leon@example.org,1105,2025-01-29 22:03:30
2904,Nostrum et rerum aspernatur molestias eos eum laboriosam modi.,mod@musedmx.com,1,3,oscarbetancourt@example.com,1105,2025-01-01 08:44:39
2905,Ad hic culpa saepe voluptate repellat voluptatum tempore alias inventore.,mod@musedmx.com,1,5,normavillareal@example.net,1105,2025-05-01 01:51:15
2906,Dicta ipsum voluptatem architecto quia.,mod@musedmx.com,1,1,roybalestela@example.net,1105,2025-02-02 22:52:07
2907,Sit qui distinctio culpa illum exercitationem quisquam blanditiis.,mod@musedmx.com,1,2,ysamaniego@example.org,1105,2025-03-10 22:21:06
2908,Ut distinctio suscipit modi iure quas qui soluta.,mod@musedmx.com,1,1,adelaroybal@example.com,1105,2025-01-20 19:42:48
2909,Sequi blanditiis veniam dicta voluptate voluptates iure.,mod@musedmx.com,1,1,gmadera@example.org,1105,2025-03-17 05:46:13
2910,Quo animi consectetur sed quis iusto quod similique aperiam quisquam.,mod@musedmx.com,1,4,irosas@example.com,1105,2025-04-20 01:04:36
2911,Fuga aspernatur magnam sit ipsa ipsa aperiam sunt neque.,mod@musedmx.com,1,2,esther14@example.com,1105,2025-05-05 22:12:09
2912,Magni deleniti praesentium sequi quis.,mod@musedmx.com,1,4,paola60@example.org,1105,2025-02-02 21:51:38
2913,Ut est nostrum repudiandae aut.,mod@musedmx.com,1,2,lorenzopuente@example.org,1105,2025-02-18 21:56:17
2914,Et nobis earum a earum magni consequuntur unde eius.,mod@musedmx.com,1,3,ccandelaria@example.org,1105,2025-01-04 00:37:52
2915,Mollitia ipsam omnis praesentium quidem repellat natus.,mod@musedmx.com,1,5,ecalderon@example.net,1105,2025-02-10 07:27:27
2916,Voluptatem reprehenderit sint voluptates praesentium vel deserunt.,mod@musedmx.com,1,3,qapodaca@example.org,1105,2025-02-26 00:27:08
2917,Saepe a voluptatibus vitae quo quos ut eum at recusandae.,mod@musedmx.com,1,4,valejandro@example.org,1105,2025-03-26 20:33:12
2918,Hic perferendis placeat accusantium iste qui.,mod@musedmx.com,1,5,esteban04@example.net,1105,2025-03-01 17:26:45
2919,Sed reprehenderit libero quas asperiores asperiores quia reprehenderit laudantium.,mod@musedmx.com,1,3,granadoesparta@example.net,1105,2025-02-24 19:21:41
2920,Ipsum voluptas iusto exercitationem at maiores maiores.,mod@musedmx.com,1,5,del-rioabigail@example.org,1105,2025-05-07 00:31:12
2921,Odio soluta omnis quidem ex nobis distinctio mollitia autem.,mod@musedmx.com,1,4,jgalarza@example.net,1105,2025-04-23 21:43:20
2922,Ut optio quis quibusdam officia deserunt corrupti.,mod@musedmx.com,1,1,qcolunga@example.com,1105,2025-03-21 16:37:36
2923,Repudiandae sequi molestias a assumenda voluptatibus corporis et rerum accusamus.,mod@musedmx.com,1,4,joaquinleon@example.net,1105,2025-04-16 04:04:04
2924,Animi reprehenderit dignissimos ex et itaque debitis.,mod@musedmx.com,1,1,olivia36@example.org,1105,2025-04-10 22:27:38
2925,Omnis veritatis placeat deserunt necessitatibus eligendi accusamus reiciendis eos fuga.,mod@musedmx.com,1,4,eloy78@example.net,1105,2025-05-18 21:00:52
2926,Fuga dolores sit voluptates error repellendus omnis voluptatibus.,mod@musedmx.com,1,1,ivancasanova@example.com,1105,2025-05-01 22:14:04
2927,Assumenda est vitae magnam autem ducimus maxime.,mod@musedmx.com,1,1,anel09@example.com,1105,2025-04-19 04:00:50
2928,Maxime fugit veniam aspernatur tempore atque non sunt similique.,mod@musedmx.com,1,4,caballerojulio@example.com,1105,2025-03-13 18:33:44
2929,Dolorum repudiandae illum ad occaecati mollitia.,mod@musedmx.com,1,1,rufinodelgadillo@example.com,1105,2025-05-21 05:25:27
2930,Officia esse nisi accusantium tempora sequi itaque.,mod@musedmx.com,1,1,dulce55@example.com,1105,2025-05-06 01:26:41
2931,Consectetur error blanditiis culpa hic quas.,mod@musedmx.com,1,2,iglesiashoracio@example.net,1105,2025-02-16 05:47:26
2932,Quaerat neque adipisci accusantium provident sint autem reprehenderit.,mod@musedmx.com,1,5,acordero@example.com,1105,2025-02-24 00:05:18
2933,Adipisci blanditiis ipsam minima dolor.,mod@musedmx.com,1,3,sonia28@example.com,1105,2025-01-05 01:17:49
2934,Labore vero vel ipsam tempora autem odit officiis dicta.,mod@musedmx.com,1,3,fidel14@example.com,1105,2025-05-10 04:53:37
2935,Sit fugit veritatis consequatur quae amet nobis beatae corporis.,mod@musedmx.com,1,3,rubyesparza@example.com,1105,2025-02-02 14:22:39
2936,Eos aspernatur ex molestiae dignissimos reiciendis adipisci numquam porro consectetur.,mod@musedmx.com,1,5,javier96@example.org,1105,2025-02-15 04:45:52
2937,Debitis commodi rem tenetur magnam unde.,mod@musedmx.com,1,3,dgarza@example.com,1105,2025-05-21 09:06:16
2938,Molestias a voluptatum rerum perferendis minima debitis sequi.,mod@musedmx.com,1,5,saldanasoledad@example.com,1105,2025-04-05 11:30:33
2939,Dignissimos omnis nulla nostrum vero atque incidunt sed nesciunt.,mod@musedmx.com,1,4,gracielacordova@example.net,1105,2025-02-15 20:13:45
2940,Et voluptatum ad itaque vero dolor velit.,mod@musedmx.com,1,3,ytorres@example.com,1105,2025-05-31 03:59:45
2941,Tenetur nulla sint eligendi est nobis nemo.,mod@musedmx.com,1,3,rodolfo57@example.org,1105,2025-01-16 23:16:49
2942,Molestiae eos reprehenderit reiciendis pariatur dignissimos libero quod iusto et.,mod@musedmx.com,1,5,avilaenrique@example.net,1105,2025-02-22 07:11:35
2943,Laudantium fugiat optio suscipit blanditiis odit mollitia qui.,mod@musedmx.com,1,1,genaro38@example.org,1105,2025-04-20 17:15:51
2944,Nesciunt voluptate ipsa quas consequuntur ex rem maiores corrupti vero.,mod@musedmx.com,1,2,camilonava@example.com,1105,2025-03-05 16:34:36
2945,Minus cumque molestiae quibusdam sed sit nobis id quos ratione.,mod@musedmx.com,1,2,maria-josepuga@example.com,1105,2025-03-02 15:24:07
2946,Incidunt inventore libero numquam similique numquam eaque quae consequatur assumenda.,mod@musedmx.com,1,2,pcarvajal@example.net,1105,2025-04-03 12:34:42
2947,Corporis ullam quod voluptatibus maxime quod ea praesentium.,mod@musedmx.com,1,1,leonardochavarria@example.org,1105,2025-01-20 02:17:39
2948,Odio atque deserunt quas porro voluptatem.,mod@musedmx.com,1,2,jose-emilio94@example.org,1105,2025-01-29 11:06:56
2949,Enim ratione amet unde maxime.,mod@musedmx.com,1,5,gsolorio@example.net,1105,2025-03-29 10:15:28
2950,Ipsa nemo nihil et hic explicabo dolores soluta quas ipsa.,mod@musedmx.com,1,5,madridserafin@example.net,1105,2025-05-08 20:24:41
2951,Ad ex est odit veritatis perspiciatis similique pariatur nesciunt.,mod@musedmx.com,1,1,vmelgar@example.org,1105,2025-04-04 03:22:26
2952,Suscipit id pariatur facilis ut beatae harum.,mod@musedmx.com,1,3,ramosdaniela@example.org,1105,2025-05-14 10:36:52
2953,Ullam voluptatem et cumque reiciendis.,mod@musedmx.com,1,4,rosarioulloa@example.org,1105,2025-03-12 17:26:55
2954,Provident ut velit facere omnis modi debitis deserunt.,mod@musedmx.com,1,3,luis-manuelpatino@example.net,1105,2025-01-02 18:57:03
2955,Quas praesentium et corrupti qui provident ullam quis cupiditate.,mod@musedmx.com,1,3,juan-carlos74@example.com,1105,2025-05-27 02:50:42
2956,Labore tempora incidunt necessitatibus est quam sint.,mod@musedmx.com,1,5,lilia68@example.org,1105,2025-05-08 07:01:03
2957,Vitae ullam repudiandae magni ut explicabo consequatur excepturi animi.,mod@musedmx.com,1,2,xmeraz@example.net,1105,2025-01-18 15:55:27
2958,Fugit dolore voluptates veritatis commodi corrupti voluptas ex consequuntur consectetur laborum.,mod@musedmx.com,1,4,yzamora@example.org,1105,2025-01-10 04:58:59
2959,Excepturi inventore impedit reprehenderit perferendis ipsum illo.,mod@musedmx.com,1,3,pinedaaldo@example.com,1105,2025-05-20 12:16:53
2960,Omnis aliquam quasi odio inventore.,mod@musedmx.com,1,5,gbriseno@example.net,1105,2025-06-01 04:58:37
2961,Unde ipsam saepe voluptates ratione harum perspiciatis aliquid odit.,mod@musedmx.com,1,3,ttoro@example.com,1105,2025-01-03 18:05:23
2962,Tempora voluptatum quae quasi ipsa.,mod@musedmx.com,1,2,carrillodaniel@example.net,1105,2025-05-30 18:27:28
2963,Voluptatum dignissimos atque dolorem totam ut.,mod@musedmx.com,1,5,frida66@example.net,1105,2025-06-04 19:28:48
2964,Ex iure nemo sapiente dignissimos neque quasi accusamus similique.,mod@musedmx.com,1,3,leonor86@example.com,1105,2025-02-20 04:26:18
2965,Rem praesentium veritatis voluptatem voluptas aperiam quod autem quidem.,mod@musedmx.com,1,5,villegasvictor@example.org,1105,2025-03-23 15:10:55
2966,Sunt voluptate nisi minus accusamus itaque eligendi vel nostrum.,mod@musedmx.com,1,5,armando38@example.net,1105,2025-03-31 04:18:19
2967,Enim excepturi magnam deserunt nobis aperiam temporibus temporibus.,mod@musedmx.com,1,2,omar70@example.com,1105,2025-05-18 19:58:21
2968,Cupiditate voluptatum saepe sapiente repudiandae tenetur autem modi sit.,mod@musedmx.com,1,3,aangulo@example.com,1105,2025-02-14 10:13:22
2969,Animi quia unde delectus ipsum occaecati blanditiis placeat cum.,mod@musedmx.com,1,2,mgastelum@example.net,1105,2025-05-03 00:26:32
2970,Deleniti voluptates magnam sint repellendus nisi id.,mod@musedmx.com,1,3,lalonso@example.com,1105,2025-05-28 22:45:00
2971,Eos cupiditate perferendis eaque minima a eius laboriosam dicta vitae.,mod@musedmx.com,1,1,holguinasuncion@example.com,1105,2025-05-10 19:20:28
2972,Consequuntur accusamus accusantium corrupti tenetur accusantium in culpa perspiciatis.,mod@musedmx.com,1,4,raquel03@example.org,1105,2025-03-22 14:32:22
2973,Animi consectetur sint laboriosam aliquid beatae repudiandae laborum.,mod@musedmx.com,1,4,rodolfo82@example.org,1105,2025-01-20 06:25:42
2974,Esse vel accusamus nesciunt commodi dolorum magni eum id vel.,mod@musedmx.com,1,5,mariano37@example.com,1105,2025-05-23 12:28:57
2975,A ut dolorum facere fugiat corporis.,mod@musedmx.com,1,5,cesarbatista@example.net,1105,2025-05-09 11:09:31
2976,Facilis voluptatem deserunt dolorum atque suscipit ducimus ipsum voluptas.,mod@musedmx.com,1,5,vergaraadalberto@example.org,1105,2025-05-20 17:10:45
2977,Vitae voluptatum expedita dignissimos repellat provident minus inventore.,mod@musedmx.com,1,1,tsosa@example.net,1105,2025-05-26 08:53:44
2978,Enim natus hic cumque nihil quos.,mod@musedmx.com,1,4,centenodiego@example.net,1105,2025-02-21 19:36:02
2979,Animi dignissimos facilis doloribus repellat dicta voluptatem doloremque soluta magnam dolorem.,mod@musedmx.com,1,3,emilia50@example.net,1105,2025-02-28 05:44:16
2980,Facere magni veniam laudantium fugit repellat voluptatum.,mod@musedmx.com,1,2,mamador@example.com,1105,2025-04-07 22:25:18
2981,Deleniti odio explicabo quasi quaerat facilis.,mod@musedmx.com,1,5,tomas41@example.net,1105,2025-04-10 15:55:11
2982,Delectus doloribus modi dolor blanditiis enim totam porro.,mod@musedmx.com,1,2,luis-manuel57@example.com,1105,2025-04-23 17:09:22
2983,Molestias earum vitae unde magnam.,mod@musedmx.com,1,5,karinaquesada@example.org,1105,2025-05-31 01:57:31
2984,Sit velit nihil vero.,mod@musedmx.com,1,5,luis-miguel95@example.org,1105,2025-04-01 12:00:18
2985,Facilis quasi quasi aperiam laborum aut ad temporibus.,mod@musedmx.com,1,1,menapilar@example.net,1105,2025-05-10 11:41:29
2986,Eos quidem ipsum accusamus tempore corrupti.,mod@musedmx.com,1,2,rebeca85@example.org,1105,2025-02-17 21:31:30
2987,Assumenda perspiciatis mollitia alias doloremque.,mod@musedmx.com,1,3,itzelcepeda@example.net,1105,2025-03-24 04:17:16
2988,Aliquid velit delectus excepturi ex mollitia distinctio.,mod@musedmx.com,1,1,wjurado@example.com,1105,2025-05-05 06:53:53
2989,Sapiente doloribus iste molestias.,mod@musedmx.com,1,1,oalmonte@example.org,1105,2025-01-05 17:18:11
2990,Molestiae necessitatibus ipsum at quis similique suscipit expedita similique ea cupiditate.,mod@musedmx.com,1,3,pchavarria@example.com,1105,2025-02-27 06:34:46
2991,Impedit quae exercitationem fugiat eveniet eligendi.,mod@musedmx.com,1,1,tvillagomez@example.net,1105,2025-01-02 05:19:00
2992,Delectus ea iusto impedit minus itaque.,mod@musedmx.com,1,1,helenaestrada@example.com,1105,2025-06-01 18:09:39
2993,Sed nam odio rem vero.,mod@musedmx.com,1,4,delia78@example.com,1105,2025-04-02 17:33:16
2994,Quas quos sequi aliquid fugit.,mod@musedmx.com,1,1,isabelrosales@example.com,1105,2025-06-04 20:57:51
2995,Tempore ratione rerum placeat sapiente quos quo itaque aut quaerat.,mod@musedmx.com,1,2,ffonseca@example.net,1105,2025-02-25 10:04:38
2996,Vel quaerat unde nostrum similique.,mod@musedmx.com,1,1,raulrosas@example.org,1105,2025-03-23 19:53:34
2997,Iure ducimus ad consectetur laboriosam similique et quas fuga.,mod@musedmx.com,1,1,psaldivar@example.com,1105,2025-06-03 00:04:28
2998,Reiciendis doloribus maxime quidem nobis soluta.,mod@musedmx.com,1,4,jose-mariacollado@example.net,1105,2025-03-19 11:40:38
2999,Aliquid quaerat porro quibusdam quia voluptatibus earum saepe.,mod@musedmx.com,1,1,regaladomaximiliano@example.com,1105,2025-01-20 20:20:12
3000,Nostrum veniam expedita dolorum saepe atque repellat eligendi dignissimos magnam.,mod@musedmx.com,1,1,luisaalcantar@example.com,1105,2025-01-11 10:30:41
=======
1,Las instalaciones estaban limpias.,mod@musedmx.com,1,1,castanedadiana@example.net,689,2025-01-14 21:14:13
2,Excelente atencin y contenido.,mod@musedmx.com,1,1,dsevilla@example.net,689,2025-02-05 04:13:59
3,Excelente atencin y contenido.,mod@musedmx.com,1,4,orojo@example.net,689,2025-01-07 21:52:42
4,Excelente atencin y contenido.,mod@musedmx.com,1,2,ariadnaiglesias@example.net,689,2025-03-19 10:51:05
5,Muy recomendable.,mod@musedmx.com,1,2,contrerasgustavo@example.com,689,2025-04-18 16:21:37
6,Un poco aburrido.,mod@musedmx.com,1,4,robertocasares@example.net,689,2025-05-20 06:47:54
7,Muy recomendable.,mod@musedmx.com,1,2,porfiriogaona@example.com,689,2025-02-25 07:12:53
8,"Estuvo bien, aunque podra mejorar.",mod@musedmx.com,1,3,jose-luisceballos@example.org,689,2025-05-20 23:26:09
