res_id_res,res_comentario,res_mod_correo,res_aprobado,res_calif_estrellas,visitas_vi_usr_correo,visitas_vi_mus_id,visitas_vi_fechahora
<<<<<<< HEAD
1,Quo enim quod explicabo nam reiciendis perferendis.,mod@musedmx.com,1,3,modesto43@example.org,759,2025-02-23 08:37:36
2,Qui quas pariatur cupiditate dolor velit odio libero expedita recusandae.,mod@musedmx.com,1,1,teresa91@example.org,759,2025-03-01 19:44:44
3,Labore exercitationem sit adipisci exercitationem molestias.,mod@musedmx.com,1,2,aracelide-leon@example.org,759,2025-01-04 05:30:08
4,Nobis ut vel adipisci esse.,mod@musedmx.com,1,5,oscarbetancourt@example.com,759,2025-03-06 02:49:33
5,Necessitatibus nulla atque veniam labore quae earum sed magni.,mod@musedmx.com,1,2,normavillareal@example.net,759,2025-04-11 10:14:39
6,Quaerat molestiae placeat placeat iure.,mod@musedmx.com,1,3,roybalestela@example.net,759,2025-04-08 06:15:02
7,Voluptate maiores atque est officiis est fugit natus delectus nihil.,mod@musedmx.com,1,2,ysamaniego@example.org,759,2025-05-22 10:10:42
8,Rerum ratione eos molestias cumque ratione.,mod@musedmx.com,1,2,adelaroybal@example.com,759,2025-04-19 13:56:23
9,Voluptas optio molestias esse fugit.,mod@musedmx.com,1,2,gmadera@example.org,759,2025-01-10 16:52:49
10,Temporibus consequuntur eum ut illum.,mod@musedmx.com,1,1,irosas@example.com,759,2025-05-04 07:14:09
11,Voluptatum ab aspernatur in excepturi ab ullam libero deleniti perspiciatis.,mod@musedmx.com,1,4,esther14@example.com,759,2025-02-14 02:16:01
12,Nostrum facilis numquam nisi deleniti ad corrupti vel.,mod@musedmx.com,1,4,paola60@example.org,759,2025-05-25 18:15:59
13,Accusantium numquam praesentium sed velit aut expedita excepturi occaecati.,mod@musedmx.com,1,2,lorenzopuente@example.org,759,2025-02-28 17:08:54
14,Officia asperiores quasi commodi quia non necessitatibus enim cumque nulla.,mod@musedmx.com,1,5,ccandelaria@example.org,759,2025-05-14 07:36:25
15,Temporibus perferendis cum beatae nihil a in.,mod@musedmx.com,1,2,ecalderon@example.net,759,2025-02-20 20:20:05
16,At ullam earum sit voluptates asperiores dolores eius sunt repellat.,mod@musedmx.com,1,4,qapodaca@example.org,759,2025-04-06 01:34:53
17,Aliquam illum dolore rerum illo at.,mod@musedmx.com,1,4,valejandro@example.org,759,2025-04-04 02:06:48
18,Id error quasi vero odit dolor iure voluptatum maxime non.,mod@musedmx.com,1,5,esteban04@example.net,759,2025-02-10 03:14:43
19,Reiciendis doloremque soluta laudantium.,mod@musedmx.com,1,5,granadoesparta@example.net,759,2025-03-05 17:37:24
20,Non quo animi doloribus vitae.,mod@musedmx.com,1,2,del-rioabigail@example.org,759,2025-01-17 19:16:23
21,Cum aspernatur veritatis explicabo quidem assumenda.,mod@musedmx.com,1,4,jgalarza@example.net,759,2025-02-11 06:59:13
22,Ipsa nam ab explicabo quod nesciunt distinctio iste dignissimos aspernatur.,mod@musedmx.com,1,3,qcolunga@example.com,759,2025-04-29 00:31:29
23,Quis soluta praesentium eveniet aliquam ullam.,mod@musedmx.com,1,4,joaquinleon@example.net,759,2025-04-13 23:01:27
24,Quia velit a minus officia.,mod@musedmx.com,1,1,olivia36@example.org,759,2025-03-14 12:44:58
25,Odio eius numquam quam sunt et molestias aliquid reprehenderit.,mod@musedmx.com,1,3,eloy78@example.net,759,2025-06-02 01:03:22
26,Consequatur ipsum dignissimos rem nobis ut culpa incidunt nulla.,mod@musedmx.com,1,1,ivancasanova@example.com,759,2025-05-07 12:36:18
27,Aut et harum autem necessitatibus.,mod@musedmx.com,1,3,anel09@example.com,759,2025-02-03 00:54:19
28,Distinctio repellat atque dolore quam voluptatum.,mod@musedmx.com,1,3,caballerojulio@example.com,759,2025-03-14 19:54:22
29,Aliquam corporis nemo unde aut facere totam et sed.,mod@musedmx.com,1,1,rufinodelgadillo@example.com,759,2025-05-04 10:22:50
30,Nihil dicta est nisi eligendi dolores dolore quaerat velit.,mod@musedmx.com,1,1,dulce55@example.com,759,2025-01-25 09:00:58
31,Repellat alias ut ullam accusamus corporis itaque nihil maiores.,mod@musedmx.com,1,2,iglesiashoracio@example.net,759,2025-01-08 19:36:58
32,Eveniet delectus veritatis ratione quaerat earum.,mod@musedmx.com,1,1,acordero@example.com,759,2025-02-01 17:01:27
33,Neque voluptatibus fugit incidunt asperiores eius libero.,mod@musedmx.com,1,4,sonia28@example.com,759,2025-05-22 09:25:23
34,Molestias assumenda placeat neque fugiat ut dolorum praesentium.,mod@musedmx.com,1,4,fidel14@example.com,759,2025-02-02 00:45:46
35,Dignissimos reprehenderit architecto officia velit facilis praesentium suscipit.,mod@musedmx.com,1,4,rubyesparza@example.com,759,2025-03-23 17:58:19
36,Aspernatur a temporibus dignissimos assumenda officia deserunt voluptatum blanditiis.,mod@musedmx.com,1,1,javier96@example.org,759,2025-05-06 20:48:53
37,Fugiat earum vel dolore veniam alias id quidem reiciendis consectetur.,mod@musedmx.com,1,2,dgarza@example.com,759,2025-05-03 04:59:14
38,Quia quos soluta quisquam nostrum modi.,mod@musedmx.com,1,3,saldanasoledad@example.com,759,2025-05-11 14:16:10
39,Cum ipsam quia debitis repellat quidem eveniet rerum itaque ab.,mod@musedmx.com,1,2,gracielacordova@example.net,759,2025-05-21 16:29:04
40,Eligendi earum aperiam cupiditate ratione sit dignissimos.,mod@musedmx.com,1,3,ytorres@example.com,759,2025-05-06 23:57:35
41,Quasi non earum deserunt veniam.,mod@musedmx.com,1,3,rodolfo57@example.org,759,2025-04-22 09:51:25
42,Error est unde architecto iste molestias voluptas animi.,mod@musedmx.com,1,5,avilaenrique@example.net,759,2025-04-23 06:26:46
43,Officiis debitis officia cum veritatis praesentium aliquid esse quaerat.,mod@musedmx.com,1,5,genaro38@example.org,759,2025-03-21 14:59:14
44,Neque assumenda minus accusantium saepe accusantium fuga ipsum ratione amet.,mod@musedmx.com,1,2,camilonava@example.com,759,2025-04-23 15:36:51
45,Rem repudiandae suscipit qui consequatur reprehenderit perferendis reiciendis cum.,mod@musedmx.com,1,3,maria-josepuga@example.com,759,2025-04-01 21:14:25
46,Occaecati consectetur nemo totam repellat sapiente quae.,mod@musedmx.com,1,3,pcarvajal@example.net,759,2025-02-26 21:39:09
47,Magnam corporis error sunt explicabo.,mod@musedmx.com,1,1,leonardochavarria@example.org,759,2025-05-11 20:11:52
48,Expedita eaque commodi recusandae omnis deleniti.,mod@musedmx.com,1,2,jose-emilio94@example.org,759,2025-03-30 07:31:30
49,Id saepe minus voluptatem totam consectetur quos aliquid illum tempore.,mod@musedmx.com,1,1,gsolorio@example.net,759,2025-01-18 01:47:17
50,Atque quibusdam nulla voluptatibus alias dolore tempore quod.,mod@musedmx.com,1,4,madridserafin@example.net,759,2025-02-23 01:22:15
51,Pariatur qui temporibus natus rerum repudiandae.,mod@musedmx.com,1,1,vmelgar@example.org,759,2025-05-03 05:40:23
52,Perferendis provident accusantium reprehenderit dicta.,mod@musedmx.com,1,3,ramosdaniela@example.org,759,2025-01-18 12:15:19
53,Molestias doloremque dolorem perspiciatis rerum.,mod@musedmx.com,1,5,rosarioulloa@example.org,759,2025-01-30 09:11:00
54,Ullam nulla tempora expedita quisquam accusantium dolorum perferendis eligendi.,mod@musedmx.com,1,5,luis-manuelpatino@example.net,759,2025-04-26 11:28:37
55,Dicta beatae ab nulla vel dicta.,mod@musedmx.com,1,2,juan-carlos74@example.com,759,2025-02-07 01:19:39
56,Quasi ab sapiente fugiat ut id debitis enim temporibus esse.,mod@musedmx.com,1,3,lilia68@example.org,759,2025-01-06 11:49:30
57,Eligendi ipsum natus corporis distinctio labore.,mod@musedmx.com,1,5,xmeraz@example.net,759,2025-04-13 21:27:14
58,Magni id nesciunt esse reiciendis unde excepturi.,mod@musedmx.com,1,4,yzamora@example.org,759,2025-01-07 15:45:35
59,Quasi optio sequi fuga.,mod@musedmx.com,1,2,pinedaaldo@example.com,759,2025-02-07 13:01:23
60,Reprehenderit minus dolores ea iure fugit quod soluta hic.,mod@musedmx.com,1,5,gbriseno@example.net,759,2025-04-10 12:09:33
61,Iure minima aut ipsam hic adipisci.,mod@musedmx.com,1,3,ttoro@example.com,759,2025-03-06 14:13:08
62,Dicta corporis magni eaque exercitationem labore veniam blanditiis.,mod@musedmx.com,1,4,carrillodaniel@example.net,759,2025-05-01 07:54:45
63,Voluptas placeat sit odit illo nulla enim velit saepe ducimus nisi.,mod@musedmx.com,1,1,frida66@example.net,759,2025-02-01 15:11:56
64,Mollitia maxime quaerat natus similique.,mod@musedmx.com,1,3,leonor86@example.com,759,2025-01-19 18:55:31
65,Quae perspiciatis sapiente cumque quidem saepe libero velit.,mod@musedmx.com,1,1,villegasvictor@example.org,759,2025-01-25 17:22:33
66,Tempore tempore pariatur quod tempora earum vero.,mod@musedmx.com,1,4,armando38@example.net,759,2025-05-11 14:35:11
67,Impedit quisquam sunt minus molestias natus repellendus eligendi quasi vitae delectus.,mod@musedmx.com,1,3,omar70@example.com,759,2025-06-01 12:39:06
68,Porro iste iste qui aliquid beatae.,mod@musedmx.com,1,3,aangulo@example.com,759,2025-02-26 05:52:16
69,Maxime incidunt asperiores id beatae minima tempore at in.,mod@musedmx.com,1,3,mgastelum@example.net,759,2025-02-26 01:11:55
70,Tempora blanditiis facilis eaque accusamus eos architecto illo dolorum nostrum.,mod@musedmx.com,1,1,lalonso@example.com,759,2025-05-22 23:05:18
71,Aperiam voluptatibus aspernatur rem dolores necessitatibus.,mod@musedmx.com,1,4,holguinasuncion@example.com,759,2025-04-16 06:17:12
72,Qui suscipit quas vitae aspernatur dolore dolorem.,mod@musedmx.com,1,1,raquel03@example.org,759,2025-04-24 22:39:30
73,Deleniti a sint aspernatur.,mod@musedmx.com,1,3,rodolfo82@example.org,759,2025-01-20 05:52:01
74,Sunt cupiditate architecto qui nostrum cum.,mod@musedmx.com,1,5,mariano37@example.com,759,2025-05-05 06:58:34
75,Enim asperiores tempora veritatis magni soluta illo dignissimos.,mod@musedmx.com,1,1,cesarbatista@example.net,759,2025-01-28 03:46:12
76,Quisquam optio quidem corporis natus magnam iure rem.,mod@musedmx.com,1,5,vergaraadalberto@example.org,759,2025-05-23 00:57:11
77,Ducimus at molestiae neque excepturi incidunt quis distinctio non vel.,mod@musedmx.com,1,5,tsosa@example.net,759,2025-03-28 21:33:56
78,Alias excepturi ex a aut nam consectetur minus.,mod@musedmx.com,1,5,centenodiego@example.net,759,2025-05-12 00:43:50
79,Dicta voluptates itaque ea quam velit saepe ullam consectetur.,mod@musedmx.com,1,1,emilia50@example.net,759,2025-02-20 11:56:26
80,Laboriosam nemo veritatis quia voluptatibus maiores temporibus.,mod@musedmx.com,1,2,mamador@example.com,759,2025-05-23 04:24:16
81,Cum quia pariatur cupiditate eveniet autem voluptate quas earum reprehenderit.,mod@musedmx.com,1,4,tomas41@example.net,759,2025-01-07 22:40:22
82,Totam maxime sit beatae explicabo voluptatum voluptatem voluptatem temporibus.,mod@musedmx.com,1,3,luis-manuel57@example.com,759,2025-04-02 18:14:52
83,Nihil expedita amet ipsam non.,mod@musedmx.com,1,3,karinaquesada@example.org,759,2025-04-29 11:52:48
84,Officiis assumenda nemo facere facere eveniet.,mod@musedmx.com,1,5,luis-miguel95@example.org,759,2025-02-11 00:17:59
85,Quis dolor repellendus nobis saepe eius sapiente harum reiciendis quidem.,mod@musedmx.com,1,2,menapilar@example.net,759,2025-02-13 00:45:17
86,Fugit veniam laboriosam temporibus itaque cumque.,mod@musedmx.com,1,5,rebeca85@example.org,759,2025-03-24 17:07:57
87,Sunt similique qui deleniti fugiat aut.,mod@musedmx.com,1,4,itzelcepeda@example.net,759,2025-04-13 04:48:37
88,Possimus ut consectetur assumenda porro doloremque assumenda eum laboriosam.,mod@musedmx.com,1,5,wjurado@example.com,759,2025-04-12 03:54:26
89,Eius voluptatibus accusantium provident sunt eaque.,mod@musedmx.com,1,5,oalmonte@example.org,759,2025-01-10 07:25:42
90,Fugit enim ipsa reprehenderit quae vero.,mod@musedmx.com,1,1,pchavarria@example.com,759,2025-04-05 14:07:23
91,Deleniti hic non labore beatae neque doloribus.,mod@musedmx.com,1,2,tvillagomez@example.net,759,2025-04-25 17:55:11
92,Recusandae similique rerum iusto eum architecto eveniet.,mod@musedmx.com,1,1,helenaestrada@example.com,759,2025-02-17 01:26:40
93,Illum cumque voluptate corrupti facilis.,mod@musedmx.com,1,4,delia78@example.com,759,2025-01-23 11:11:41
94,Minus voluptate quia nulla.,mod@musedmx.com,1,5,isabelrosales@example.com,759,2025-03-01 22:08:18
95,Libero ad incidunt saepe quaerat.,mod@musedmx.com,1,5,ffonseca@example.net,759,2025-01-13 21:50:11
96,Voluptatibus laboriosam nobis accusantium maxime.,mod@musedmx.com,1,1,raulrosas@example.org,759,2025-02-28 18:13:51
97,Optio veritatis aut enim ipsum voluptatum iure.,mod@musedmx.com,1,5,psaldivar@example.com,759,2025-06-03 01:24:21
98,Recusandae nihil eum officiis saepe similique nostrum.,mod@musedmx.com,1,1,jose-mariacollado@example.net,759,2025-01-10 12:48:25
99,Dicta rerum aspernatur blanditiis ut non.,mod@musedmx.com,1,2,regaladomaximiliano@example.com,759,2025-02-12 18:08:31
100,Adipisci quas eius libero libero modi harum iure iure.,mod@musedmx.com,1,2,luisaalcantar@example.com,759,2025-03-26 21:39:22
101,Nihil cum at rem sunt vero ex nostrum.,mod@musedmx.com,1,3,modesto43@example.org,658,2025-03-13 16:51:43
102,Asperiores impedit saepe dolorum.,mod@musedmx.com,1,4,teresa91@example.org,658,2025-05-15 05:13:18
103,Deserunt consequuntur molestias ea quis.,mod@musedmx.com,1,4,aracelide-leon@example.org,658,2025-03-17 11:50:44
104,Velit voluptatem ad dignissimos.,mod@musedmx.com,1,5,oscarbetancourt@example.com,658,2025-01-09 04:41:11
105,Sapiente alias error dolore perferendis corrupti ipsam quas.,mod@musedmx.com,1,3,normavillareal@example.net,658,2025-04-28 05:18:16
106,Soluta iure laborum asperiores laborum eveniet atque alias.,mod@musedmx.com,1,1,roybalestela@example.net,658,2025-02-05 21:23:35
107,Repudiandae consequuntur natus consectetur nostrum nobis.,mod@musedmx.com,1,4,ysamaniego@example.org,658,2025-03-24 09:52:24
108,Eligendi doloremque officia aperiam quaerat fugit iure.,mod@musedmx.com,1,2,adelaroybal@example.com,658,2025-03-16 18:40:24
109,Quia ipsa iure explicabo ad.,mod@musedmx.com,1,2,gmadera@example.org,658,2025-05-06 12:14:59
110,Corrupti officia neque placeat quidem consequuntur.,mod@musedmx.com,1,1,irosas@example.com,658,2025-06-01 15:31:04
111,Odio aliquam quae nisi voluptatum iure asperiores.,mod@musedmx.com,1,2,esther14@example.com,658,2025-02-13 12:18:09
112,Fugit deleniti itaque ratione expedita esse.,mod@musedmx.com,1,5,paola60@example.org,658,2025-05-24 12:07:27
113,Delectus dolores molestiae velit sed distinctio neque.,mod@musedmx.com,1,5,lorenzopuente@example.org,658,2025-02-03 02:26:00
114,Eligendi ea excepturi distinctio ad ullam quos in beatae veniam.,mod@musedmx.com,1,3,ccandelaria@example.org,658,2025-05-09 18:53:28
115,Totam iure quia laborum quisquam corporis cupiditate odit libero repudiandae.,mod@musedmx.com,1,2,ecalderon@example.net,658,2025-03-06 19:58:55
116,Optio vero temporibus vel ullam voluptate.,mod@musedmx.com,1,2,qapodaca@example.org,658,2025-03-05 01:16:42
117,Fugiat enim error ipsum mollitia laudantium.,mod@musedmx.com,1,1,valejandro@example.org,658,2025-04-25 23:56:12
118,A commodi veritatis culpa quod eaque culpa quasi.,mod@musedmx.com,1,4,esteban04@example.net,658,2025-05-10 19:13:55
119,Nostrum impedit doloribus deserunt iusto.,mod@musedmx.com,1,3,granadoesparta@example.net,658,2025-01-25 04:59:46
120,Quia laborum deserunt totam ex harum beatae at eius iusto.,mod@musedmx.com,1,3,del-rioabigail@example.org,658,2025-04-25 21:26:19
121,Sit cupiditate sequi quia aliquid animi odio ratione.,mod@musedmx.com,1,4,jgalarza@example.net,658,2025-03-01 15:13:23
122,Consequatur illum corporis iure aliquid corrupti.,mod@musedmx.com,1,4,qcolunga@example.com,658,2025-05-15 10:56:46
123,At tenetur optio sint voluptas neque sunt voluptas numquam ea magnam.,mod@musedmx.com,1,1,joaquinleon@example.net,658,2025-03-04 23:53:21
124,Fuga quibusdam porro incidunt veritatis qui eveniet illum distinctio.,mod@musedmx.com,1,3,olivia36@example.org,658,2025-05-07 11:29:36
125,Blanditiis hic tempore facere ex cupiditate tenetur non.,mod@musedmx.com,1,4,eloy78@example.net,658,2025-03-12 03:47:42
126,Nesciunt rerum atque possimus doloremque ex recusandae praesentium.,mod@musedmx.com,1,3,ivancasanova@example.com,658,2025-04-10 01:26:58
127,Nemo rem ex facere blanditiis doloremque quo architecto aliquam blanditiis.,mod@musedmx.com,1,5,anel09@example.com,658,2025-02-16 23:01:09
128,Eaque maiores nostrum culpa distinctio mollitia ad mollitia quasi impedit.,mod@musedmx.com,1,5,caballerojulio@example.com,658,2025-01-06 12:57:54
129,Rem dolore aliquid fugit illum aperiam eos incidunt veritatis.,mod@musedmx.com,1,5,rufinodelgadillo@example.com,658,2025-02-22 19:57:45
130,Eum facere rem voluptatibus laboriosam.,mod@musedmx.com,1,5,dulce55@example.com,658,2025-02-28 22:50:19
131,Facere possimus neque dignissimos accusamus fuga exercitationem voluptate.,mod@musedmx.com,1,2,iglesiashoracio@example.net,658,2025-01-20 10:59:17
132,Blanditiis exercitationem soluta libero repudiandae eligendi quod repellat.,mod@musedmx.com,1,4,acordero@example.com,658,2025-01-13 03:09:06
133,Ab cupiditate ad consequuntur architecto.,mod@musedmx.com,1,3,sonia28@example.com,658,2025-05-04 06:47:06
134,Doloremque aperiam vero illo accusantium.,mod@musedmx.com,1,4,fidel14@example.com,658,2025-03-24 14:01:14
135,Ex ipsam reprehenderit quia vitae laborum nihil voluptatibus.,mod@musedmx.com,1,4,rubyesparza@example.com,658,2025-03-05 03:21:24
136,A eius assumenda laborum nesciunt veritatis praesentium placeat.,mod@musedmx.com,1,4,javier96@example.org,658,2025-05-31 21:35:12
137,Explicabo reiciendis asperiores ipsam cum dolore error minima exercitationem cum.,mod@musedmx.com,1,2,dgarza@example.com,658,2025-03-17 09:04:52
138,Aut in occaecati nulla soluta.,mod@musedmx.com,1,2,saldanasoledad@example.com,658,2025-04-09 14:33:00
139,Nemo nostrum at ex impedit natus delectus ducimus officia.,mod@musedmx.com,1,1,gracielacordova@example.net,658,2025-01-23 19:53:14
140,Eos vero facere numquam saepe.,mod@musedmx.com,1,3,ytorres@example.com,658,2025-05-16 21:37:13
141,Quae aut est eaque voluptatibus mollitia.,mod@musedmx.com,1,4,rodolfo57@example.org,658,2025-04-13 10:43:22
142,Neque ratione nisi officiis similique nostrum accusamus.,mod@musedmx.com,1,3,avilaenrique@example.net,658,2025-05-08 09:55:56
143,Libero magni vitae cupiditate porro vel consequatur distinctio dolores nemo.,mod@musedmx.com,1,5,genaro38@example.org,658,2025-04-11 14:28:12
144,Eius dicta molestias ratione modi.,mod@musedmx.com,1,3,camilonava@example.com,658,2025-03-03 23:18:15
145,Numquam distinctio voluptatem dolorem eos enim sequi ea impedit voluptatum.,mod@musedmx.com,1,3,maria-josepuga@example.com,658,2025-03-31 21:36:23
146,Ducimus provident consequatur odit quia ea consequatur dicta.,mod@musedmx.com,1,3,pcarvajal@example.net,658,2025-03-21 01:41:44
147,Iure doloribus ullam rem blanditiis rem ipsum.,mod@musedmx.com,1,3,leonardochavarria@example.org,658,2025-02-20 01:38:12
148,Dignissimos doloribus incidunt rerum amet tempora.,mod@musedmx.com,1,5,jose-emilio94@example.org,658,2025-04-02 20:17:08
149,Dolores molestiae consequatur praesentium dolore esse soluta.,mod@musedmx.com,1,2,gsolorio@example.net,658,2025-01-09 16:40:33
150,Fuga illum est officiis cum ipsam vitae.,mod@musedmx.com,1,1,madridserafin@example.net,658,2025-05-26 23:14:01
151,Beatae voluptatibus deserunt rerum repellat velit.,mod@musedmx.com,1,1,vmelgar@example.org,658,2025-01-26 13:05:56
152,Similique enim reprehenderit quis modi explicabo.,mod@musedmx.com,1,2,ramosdaniela@example.org,658,2025-02-27 20:17:34
153,Quae quod quas ab tempore laboriosam explicabo dolorum dolores.,mod@musedmx.com,1,2,rosarioulloa@example.org,658,2025-04-23 05:52:36
154,Rerum illo in eos.,mod@musedmx.com,1,4,luis-manuelpatino@example.net,658,2025-02-28 12:52:14
155,Quibusdam nesciunt dolor labore quis nulla sunt quisquam voluptate.,mod@musedmx.com,1,1,juan-carlos74@example.com,658,2025-04-26 01:26:55
156,Error delectus dignissimos numquam fuga consectetur.,mod@musedmx.com,1,1,lilia68@example.org,658,2025-05-12 13:53:18
157,Consequuntur ipsum quasi iste quibusdam non odit.,mod@musedmx.com,1,2,xmeraz@example.net,658,2025-03-27 08:36:55
158,Quia ullam ipsa asperiores laudantium sapiente animi quas facere.,mod@musedmx.com,1,5,yzamora@example.org,658,2025-04-25 12:16:42
159,Ab expedita ea et natus et velit quam inventore sunt.,mod@musedmx.com,1,4,pinedaaldo@example.com,658,2025-05-28 00:24:00
160,Tempora ipsum occaecati provident magnam ipsum iste in assumenda velit.,mod@musedmx.com,1,4,gbriseno@example.net,658,2025-04-10 17:06:36
161,Ab ducimus doloremque quis iusto.,mod@musedmx.com,1,1,ttoro@example.com,658,2025-01-26 23:24:29
162,Aperiam sint reiciendis magnam sed repudiandae vel.,mod@musedmx.com,1,1,carrillodaniel@example.net,658,2025-05-08 11:17:37
163,Qui laboriosam quasi aliquid.,mod@musedmx.com,1,1,frida66@example.net,658,2025-01-27 00:01:00
164,Laborum porro quae eius.,mod@musedmx.com,1,3,leonor86@example.com,658,2025-05-10 06:54:23
165,Natus quam architecto quis suscipit culpa.,mod@musedmx.com,1,3,villegasvictor@example.org,658,2025-02-23 05:34:42
166,Repellendus tempore aperiam labore veritatis.,mod@musedmx.com,1,4,armando38@example.net,658,2025-05-07 04:27:33
167,Voluptatibus sapiente dicta fuga tempore sint reprehenderit maiores.,mod@musedmx.com,1,3,omar70@example.com,658,2025-02-01 20:54:39
168,Ut a tenetur magni cum odit fugiat odio.,mod@musedmx.com,1,4,aangulo@example.com,658,2025-01-27 03:35:06
169,Non voluptatum veniam labore ut dolorem vero.,mod@musedmx.com,1,1,mgastelum@example.net,658,2025-03-27 00:37:49
170,Maiores esse quis provident recusandae placeat enim.,mod@musedmx.com,1,4,lalonso@example.com,658,2025-05-30 07:07:43
171,Culpa hic necessitatibus exercitationem minus.,mod@musedmx.com,1,3,holguinasuncion@example.com,658,2025-02-02 14:49:38
172,Aliquid reiciendis consectetur reiciendis tenetur praesentium doloremque quae.,mod@musedmx.com,1,3,raquel03@example.org,658,2025-03-20 07:31:45
173,Voluptatibus dignissimos esse rem tempore nostrum nihil rem.,mod@musedmx.com,1,3,rodolfo82@example.org,658,2025-01-11 14:41:10
174,Asperiores enim iusto animi iure quo iure tempore sit.,mod@musedmx.com,1,1,mariano37@example.com,658,2025-03-22 18:59:21
175,Nobis vero quis illo eveniet magni deserunt repudiandae natus quas.,mod@musedmx.com,1,5,cesarbatista@example.net,658,2025-03-28 06:17:09
176,Delectus tempore praesentium aliquid ducimus dicta deserunt labore quidem iure aliquid.,mod@musedmx.com,1,5,vergaraadalberto@example.org,658,2025-02-03 17:39:55
177,Nam distinctio fuga enim maxime dignissimos minus architecto officia dignissimos.,mod@musedmx.com,1,3,tsosa@example.net,658,2025-04-18 15:28:56
178,Voluptatibus consequuntur cumque officiis tenetur nobis corrupti sit corrupti molestiae illo.,mod@musedmx.com,1,5,centenodiego@example.net,658,2025-01-21 20:28:38
179,Repellat temporibus fugit culpa sed unde expedita.,mod@musedmx.com,1,4,emilia50@example.net,658,2025-05-27 13:45:26
180,Eum quasi dolorem tenetur ipsa voluptatibus.,mod@musedmx.com,1,2,mamador@example.com,658,2025-02-28 08:30:26
181,Ea ab doloremque delectus quidem sapiente.,mod@musedmx.com,1,1,tomas41@example.net,658,2025-02-22 09:10:00
182,Velit eveniet tempora occaecati sit pariatur.,mod@musedmx.com,1,5,luis-manuel57@example.com,658,2025-01-29 19:04:02
183,Ex repudiandae necessitatibus molestias modi possimus at iusto tempora autem.,mod@musedmx.com,1,2,karinaquesada@example.org,658,2025-05-30 01:34:39
184,Recusandae facere aperiam est dolore harum ratione quisquam reiciendis.,mod@musedmx.com,1,2,luis-miguel95@example.org,658,2025-05-03 17:38:03
185,Ipsam fugiat dolor voluptatibus maiores temporibus tenetur aliquam.,mod@musedmx.com,1,4,menapilar@example.net,658,2025-01-01 23:59:27
186,Maxime consequuntur voluptates eos natus odio assumenda fugit.,mod@musedmx.com,1,3,rebeca85@example.org,658,2025-01-21 03:02:27
187,Consequuntur aliquam eum labore laborum atque.,mod@musedmx.com,1,3,itzelcepeda@example.net,658,2025-05-19 14:35:19
188,Id similique quibusdam voluptatum sapiente nobis voluptates ea.,mod@musedmx.com,1,3,wjurado@example.com,658,2025-02-20 22:21:19
189,Alias aliquid molestias doloribus consequatur inventore harum.,mod@musedmx.com,1,4,oalmonte@example.org,658,2025-06-02 09:56:14
190,Mollitia fuga reprehenderit fugiat repudiandae impedit possimus nesciunt ea nostrum.,mod@musedmx.com,1,4,pchavarria@example.com,658,2025-04-30 21:46:39
191,Omnis soluta quisquam excepturi molestiae ratione provident.,mod@musedmx.com,1,3,tvillagomez@example.net,658,2025-05-12 09:31:11
192,Animi dignissimos ducimus facilis earum corporis nostrum earum quasi.,mod@musedmx.com,1,5,helenaestrada@example.com,658,2025-01-27 07:38:10
193,Veritatis optio dolores sunt aliquid corrupti impedit.,mod@musedmx.com,1,3,delia78@example.com,658,2025-01-01 20:41:18
194,Sequi sit ab dolorum porro a.,mod@musedmx.com,1,4,isabelrosales@example.com,658,2025-05-05 05:37:45
195,A commodi maxime ipsum nihil magnam veritatis neque.,mod@musedmx.com,1,1,ffonseca@example.net,658,2025-03-10 07:12:21
196,Dolorem a necessitatibus officiis libero hic.,mod@musedmx.com,1,2,raulrosas@example.org,658,2025-03-25 10:40:55
197,Fugiat inventore omnis dolores natus fugit ducimus eaque.,mod@musedmx.com,1,5,psaldivar@example.com,658,2025-01-12 05:21:35
198,Nisi sapiente amet molestiae minus labore molestias reiciendis sit repellendus.,mod@musedmx.com,1,1,jose-mariacollado@example.net,658,2025-03-29 16:23:04
199,Doloremque nihil mollitia adipisci molestiae.,mod@musedmx.com,1,3,regaladomaximiliano@example.com,658,2025-01-17 14:33:19
200,Similique facere aliquid facilis ipsum itaque vero ducimus maxime.,mod@musedmx.com,1,5,luisaalcantar@example.com,658,2025-05-30 21:47:43
201,Facere voluptatibus dolorum aliquam praesentium sapiente nesciunt ipsa cumque unde.,mod@musedmx.com,1,5,modesto43@example.org,1106,2025-05-10 09:37:32
202,Iure tempore occaecati in amet eius repellendus aliquid omnis.,mod@musedmx.com,1,2,teresa91@example.org,1106,2025-04-14 12:16:30
203,Debitis pariatur dicta voluptatibus explicabo incidunt maiores praesentium.,mod@musedmx.com,1,1,aracelide-leon@example.org,1106,2025-01-03 17:29:35
204,Minima veritatis quod tenetur animi sunt facere molestiae quia.,mod@musedmx.com,1,4,oscarbetancourt@example.com,1106,2025-05-08 20:50:38
